,Brand Name,Product Name,Rating,Rating Count,Selling Price,MRP,Offer
106,Fastrack,Fastrack Stunners Quartz Analog Peacock Green Dial Brown Leather Strap Watch for Guys - 3278SL03,4.3 out of 5 stars,271,£13.25,£17.09,(20% off)
107,Titan,Men's Strap Watch (Black),4.2 out of 5 stars,"1,053",£17.05,£18.95,(10% off)
108,Titan,Analog Brown Dial Men's Watch NM1584SL04/NN1584SL04/NP1584SL04,4.2 out of 5 stars,"1,068",£22.75,£28.45,(20% off)
109,Titan,Gents Karishma Analog Brown Dial Men's Watch NM1824KM01/NN1824KM01,4.2 out of 5 stars,224,£32.25,£40.33,(20% off)
110,Fossil,Fossil Chronograph Black Dial and Band Men's Stainless Steel Watch-BQ2364,4.1 out of 5 stars,"1,632",£71.21,£118.70,(40% off)
111,Casio,Youth Digital Analog-Digital Black Dial Men's Watch - HDC-700-3AVDF (D155),4.2 out of 5 stars,718,£37.95,£17.09,(20% off)
112,Fastrack,Vyb Arcane Quartz Analog Black Dial Watch for Men,5.0 out of 5 stars,2,£19.87,£28.40,(30% off)
113,Fastrack,Analog Silver Dial Men's Watch-NM38017PL02 / NL38017PL02/NP38017PL02,3.9 out of 5 stars,"1,041",£23.37,£27.50,(15% off)
114,Casio,Youth-Combination Analog-Digital Black Dial Men's Watch - AEQ-110W-2AVDF (AD208),4.3 out of 5 stars,833,£31.30,£17.09,(20% off)
115,Noise,"Noise Vortex Plus 1.46 AMOLED Display, AoD, BT Calling, Sleek Metal Finish, 7 Days Battery Life, All New OS with 100+ Watch Faces & Health Suite (Black)",4.0 out of 5 stars,"53,884",£20.89,£66.49,(69% off)
116,Fastrack,"Fastrack Limitless Glide X 1.83"" Smart Watch with Ultra UV HD Display, SpO2, Heart Rate & Sleep Tracking, Bluetooth Calling, 100+ Sports Modes, 5-Day Battery, Smartwatch for Men & Women (Beige)",3.8 out of 5 stars,"4,328",£14.23,£26.59,(46% off)
117,Fossil,Fossil Analog Off-White Dial Brown Band Men's Stainless Steel Watch-FS5380,4.5 out of 5 stars,"1,432",£118.70,£123.45,(4% off)
118,Shocknshop,Silver Stainless Steel Analog Square Dial Date Display Wrist Watch for Men -PGNI85,3.7 out of 5 stars,275,£4.04,£18.52,(78% off)
119,Casio,Enticer Men MTP-1374D-2A3VDF Analog Blue Dial Men (A2346),4.8 out of 5 stars,5,£56.95,£17.09,(20% off)
120,Fastrack,Fastrack Vyb Quartz Analog Silver Dial Steel Sheet Metal Strap Watch for Men-FV30002SM01W,4.3 out of 5 stars,30,£13.53,£19.33,(30% off)
121,Fastrack,Fastfit Analog Black Dial Men's Watch-3224NL01/NP3224NL01,4.2 out of 5 stars,188,£38.71,£48.40,(20% off)
122,V2A,Chronograph Ultra-Thin Unisex Multi Function Digital Sports Watch for Boy ANG Girls | Watch for Women | Wrist Watch for Men | Kid's Watch | Watches,3.9 out of 5 stars,"1,832",£5.69,£14.24,(60% off)
123,Titan,Karishma Quartz Analog Silver Dial Leather Strap Watch for Men-1825SL15/NT1825SL15,4.1 out of 5 stars,31,£30.07,£17.09,(20% off)
124,Fastrack,Fastfit Quartz Multifunction White Dial Stainless Steel Strap Watch for Guys - NT3227SM02,4.3 out of 5 stars,167,£35.58,£50.30,(29% off)
125,Noise,"Noise Quad Call 1.81"" Display, Bluetooth Calling Smart Watch, AI Voice Assistance, 160+Hrs Battery Life, Metallic Build, in-Built Games, 100 Sports Modes, 100+ Watch Faces (Elite Black)",3.9 out of 5 stars,621,£15.19,£66.49,(77% off)
126,Sonata,Analog White Dial Men's Watch NM77049YM03/NN77049YM03,4.1 out of 5 stars,"1,302",£8.07,£17.09,(20% off)
127,BENYAR,"Men's Luxury Chronograph Watch – Business, Casual | Quartz Movement with Date Display | Stylish Wristwatch | Gift for Men",4.1 out of 5 stars,"1,188",£27.45,£42.66,(36% off)
128,Matrix,"Black, Blue, White Dial, Day & Date Functioning, Stainless Steel Strap Analog Watch for Men & Women",3.6 out of 5 stars,964,£2.83,£23.74,(88% off)
129,Carlington,"Endurance Series Analog-Digital Sports Watches for Men and Boys with Alarm, Stopwatch, Backlit Display, Dualtime, Silicone Rubber Strap, Water & Shock Resiatant - CT_9105",4.0 out of 5 stars,285,£11.39,£66.49,(83% off)
130,Fastrack,Analog Silver Men Watch 3229SM03 / 3229SM03,4.3 out of 5 stars,845,£16.53,£21.80,(24% off)
131,Fastrack,Analog Brown Dial Men's Watch-FV30001QM03W,5.0 out of 5 stars,3,£17.97,£25.70,(30% off)
132,OLEVS,Men's Business Watch Gold Blue with Large Easy-Read Analog Quartz Date Display Luxury Stainless Steel Band Waterproof Luminous Hands,3.6 out of 5 stars,"1,948",£32.48,£37.05,(12% off)
133,Titan,Infinity Display Quartz Chronograph with Date Silver Dial Dark Teal Green Leather Strap Watch for Men - NT90146SL01,4.4 out of 5 stars,65,£68.35,£85.45,(20% off)
134,Noise,"Noise Halo Plus Elite Edition Smartwatch with 1.46"" Super AMOLED Display, Stainless Steel Finish Metallic Straps, 4-Stage Sleep Tracker, Smart Watch for Men and Women (Elite Silver)",4.2 out of 5 stars,"6,075",£33.24,£85.49,(61% off)
135,Fastrack,Vyb Challenger Quartz Analog Black Dial Watch for Men,4.6 out of 5 stars,5,£19.43,£27.79,(30% off)
136,boAt,"boAt Storm Call 3 w/TBT Navigation, Daily Activity Tracker, DIY Watch Face Studio,700+ Active Modes, 1.83"" (4.6 cm) HD Display Fitness Smart Watch for Men & Women(Active Black)",4.0 out of 5 stars,"33,295",£13.29,£80.27,(83% off)
137,Fastrack,Men Fleek Quartz Multifunction Green Dial Leather Strap Watch for Guys-3270SL03/NT3270SL03,3.6 out of 5 stars,12,£45.27,£50.30,(10% off)
138,TIMEX,"Leather Classics Men's Quartz Analog Champagne Dial Round Case 3 Hands Function Watch -A301, Dial_Gold, Band_Black",4.1 out of 5 stars,433,£8.30,£8.50,(2% off)
139,Fastrack,Urban Camo Black Dial Copper Brown Stainless Steel Watch for Guys - NT3295QM01,4.6 out of 5 stars,33,£31.59,£35.10,(10% off)
140,Fossil,"Machine Brown Automatic Leather Watch Me3254 - Analog, Men",5.0 out of 5 stars,7,£199.45,£17.09,(20% off)
141,Noise,"Noise Pulse 2 Max 1.85"" Display, Bluetooth Calling Smart Watch, 10 Days Battery, 550 NITS Brightness, Smart DND, 100 Sports Modes, Smartwatch for Men and Women (Deep Wine)",4.0 out of 5 stars,"17,624",£13.29,£56.99,(77% off)
142,TIMEWEAR,Analog New Track Day Date Functioning Leather Strap Watch for Men,3.6 out of 5 stars,592,£3.60,£14.24,(75% off)
143,Titan,Neo Iv Analog Black Dial Men's Watch NM1805NL01/NN1805NL01/NP1805NL01,4.4 out of 5 stars,459,£52.20,£17.09,(20% off)
144,OLEVS,Watches for Men Chronograph Business Wrist Watches Analog Quartz Moon Phase Stainless Steel Waterproof Luminous Dress Watches,3.8 out of 5 stars,"2,984",£28.97,£37.05,(22% off)
145,Fossil,"Machine Brown Automatic Leather Watch Me3254 - Analog, Men",5.0 out of 5 stars,7,£199.45,£17.09,(20% off)
146,TIMEWEAR,Analog New Track Day Date Functioning Leather Strap Watch for Men,3.6 out of 5 stars,592,£3.60,£14.24,(75% off)
147,Fire-Boltt,"Fire-Boltt Phoenix Pro Smart Watch 1.39 inch Bluetooth Calling, AI Voice Assistant, Metal Body with 120+ Sports Modes, SpO2, Heart Rate Monitoring (Black)",3.9 out of 5 stars,"81,935",£18.99,£113.99,(83% off)
148,TIMEX,"Leather Classics Men's Quartz Analog Champagne Dial Round Case 3 Hands Function Watch -A301, Dial_Gold, Band_Black",4.1 out of 5 stars,433,£8.30,£8.50,(2% off)
149,Sonata,Quartz Analog with Date Black Dial Watch for Men-NS77105NM01,4.1 out of 5 stars,13,£16.86,£17.09,(20% off)
150,Fastrack,Analog Grey Dial Men's Watch-FV30004QM01W,5.0 out of 5 stars,1,£17.01,£24.32,(30% off)
151,Carlington,Endurance Series Analog-Digital Wrist Watches for Men - CT_9145,4.0 out of 5 stars,23,£12.34,£66.49,(81% off)
152,Fire-Boltt,"Fire-Boltt Ring X Smartwatch 2.01” Display with Always On Display, Bluetooth Calling, Wireless Charging, AI Voice Assistant, 100+ Sports Modes, Health Suite, 500+ Watchfaces (Blue S)",3.9 out of 5 stars,"5,095",£12.82,£94.99,(87% off)
153,Redmi,"Redmi Watch 5 Active, 2 Display, Metal Body, 18 Day Battery, Bluetooth Calling, Advanced AI Noise Cancellation, Alexa, Black",4.0 out of 5 stars,331,£19.47,£47.49,(59% off)
154,Fastrack,Vyb Pioneer Quartz Analog Black Dial Watch for Men,3.8 out of 5 stars,17,£15.12,£21.61,(30% off)
155,OLEVS,Chronograph Watches for Men Original Analog Quartz Black Stainless Steel Chain Luxury Dual Time Zone Moon Phase Date Waterproof Men's Wrist Watch,4.0 out of 5 stars,664,£32.49,£37.05,(12% off)
156,TIMEX,"Men Stainless Steel Classics Analog Silver Dial Watch-Ti000R420, Band Color-Silver",4.1 out of 5 stars,123,£25.60,£17.09,(20% off)
157,Fastrack,Vyb Hustler Quartz Analog Green Dial Watch for Men,3.4 out of 5 stars,34,£15.66,£22.18,(29% off)
158,Fire-Boltt,"Fire-Boltt Ninja Call Pro Max Smart Watch 2.01 inch Display, Bluetooth Calling, 120+ Sports Modes, Health Suite, Voice Assistance (Grey)",3.9 out of 5 stars,"95,014",£16.82,£142.49,(88% off)
159,boAt,"boAt New Launch Ultima Prime smartwatch with 1.43” AMOLED Display, Personalized Fitness Nudges, Functional Crown,100+ Sports Modes, Watch Face Studio (Onyx Black)",4.0 out of 5 stars,"2,012",£20.89,£85.49,(76% off)
160,Titan,Lagan Quartz Analog with Day and Date White Dial Two Toned Silver and Gold Metal Strap Watch for Men - NT1775BM02,3.8 out of 5 stars,98,£27.78,£36.05,(23% off)
161,LOUIS DEVIN,LD-BK047-GLDBLK Black Dial and Band Stainless Steel Metal Chain Analog Wrist Watch for Men,3.7 out of 5 stars,473,£4.36,£24.69,(82% off)
162,LONGBO,Master Royale Analog Stainless Steel Watch For Men,4.0 out of 5 stars,"1,211",£11.30,£18.99,(40% off)
163,Shocknshop,Shocknshop Digital Sports Multi Functional Black Dial Watch for Men Boys -WCH79 (Blue),3.7 out of 5 stars,391,£4.04,£12.72,(68% off)
164,Fire-Boltt,"Fire-Boltt Rise Smart Watch, 1.85"" HD Display, Metal Body with Bluetooth Calling, Rotating Crown, AI Voice Assistant, 120 Sports Modes, Neon UI, SpO2 & Heart Rate Monitoring (Black)",3.7 out of 5 stars,"1,764",£11.39,£113.99,(90% off)
165,CULTSPORT,"Cult Ranger XR1-1.43"" AMOLED Display,Outdoor Rugged Smartwatch for Men, Bluetooth Calling, 8 Days Battery, Continous Heart Rate,100+ Sports Mode, Live Cricket Score, Built-in Flashlight, Free Strap",3.3 out of 5 stars,236,£17.95,£94.99,(81% off)
166,LOUIS DEVIN,Silicone Strap Analog Wrist Watch for Men (Green/Brown/Blue/Black Dial) | LD-GR092-ST,4.6 out of 5 stars,17,£3.32,£18.99,(83% off)
167,Sonata,Sonata Poze Quartz Analog Black Dial Leather Strap Watch for Men-SP70039KL01W,3.9 out of 5 stars,38,£5.42,£11.83,(54% off)
168,Titan,Neo Iv Analog Black Dial Men's Watch NM1805NL01/NN1805NL01/NP1805NL01,4.4 out of 5 stars,459,£52.20,£17.09,(20% off)
169,V2A,Analogue - Digital Men's Watch (Black Dial Silver Colored Strap),3.8 out of 5 stars,"1,686",£11.30,£28.49,(60% off)
170,Fastrack,"Bare Basics Analog Grey Dial Men's Watch-3247NM02/NP3247NM02 Stainless Steel, Black Strap",4.1 out of 5 stars,28,£19.91,£26.55,(25% off)
171,boAt,"boAt New Launch Ultima Ember Smartwatch w/ 1.96” (4.97 cm) AMOLED Display, Personalized Fitness Nudges, Functional Crown, 100+ Sports Modes, Custom Watch Faces (Bold Black)",4.0 out of 5 stars,"1,238",£20.89,£85.49,(76% off)
172,TIMEX,Analog Dial Black Men watch-TWHG03SMU17,4.0 out of 5 stars,165,£34.16,£56.95,(40% off)
173,Casio,Edifice EFV-C100D-1AVDF Black Analog-Digital Dial Silver Stainless Steel Band Men's Watch World Time 100M Water Resistant EX438,4.1 out of 5 stars,525,£99.70,£17.09,(20% off)
174,Casio,G-Shock GA-100-1A1DR Analog-Digital Black Dial Men Watch Black Resin Strap (G270),4.4 out of 5 stars,770,£89.92,£90.20,(20% off)
175,LOUIS DEVIN,Steel Chain Analog Wrist Watch for Men (White/Blue/Black Dial) | LD-GR062-CH,3.3 out of 5 stars,88,£3.13,£18.99,(84% off)
176,Titan,Neo Analog Blue Dial Men's Watch NM1769SM01/NN1769SM01,4.2 out of 5 stars,325,£45.55,£59.80,(24% off)
177,Fastrack,"Fastrack Limitless FS2+ Smart Watch, 2.01"" UltraVU Display, Functional Crown, SingleSync BT Calling, 110+ Sports Modes, 200+ Smartwatch Faces, Upto 7 Day Battery, AI Voice Assistant (Black)",3.8 out of 5 stars,"4,328",£15.18,£28.45,(47% off)
178,Sonata,Analog Black Dial Men's Watch-NN7924NM01/NP7924NM01,4.2 out of 5 stars,"4,896",£16.86,£17.09,(20% off)
179,Casio,MTP-VT01L-1B Men's Minimalistic Black Dial Black Leather Band Analog Watch,4.3 out of 5 stars,"1,316",£31.30,£17.09,(20% off)
180,Fastrack,All Nighters Quartz Multifunction Black Dial Brown Leather Strap Watch for Guys - NT3165NL01,4.3 out of 5 stars,386,£39.47,£52.20,(24% off)
181,Fastrack,Mean Machines Analog-Digital Black Dial Men's Watch 38055PP01/NN38055PP01,4.3 out of 5 stars,161,£28.83,£37.95,(24% off)
182,Fastrack,Fastrack Analog Black Dial Men's Casual Leather Watch/NT3277SL02,4.1 out of 5 stars,321,£12.25,£22.75,(46% off)
183,Fastrack,Tees Wanderlust Quartz Analog Black Dial Silicone Strap Watch for Unisex-38024PP71W/NT38024PP71W,4.2 out of 5 stars,25,£8.50,£9.45,(10% off)
184,Fastrack,Vyb Drift Quartz Analog Green Dial Watch for Men,3.7 out of 5 stars,9,£17.00,£24.32,(30% off)
185,Fire-Boltt,"Fire-Boltt Ninja Call Pro Max Smart Watch 2.01 inch Display, Bluetooth Calling, 120+ Sports Modes, Health Suite, Voice Assistance (Black)",3.9 out of 5 stars,"95,014",£18.04,£142.49,(87% off)
186,Fastrack,After Dark Quartz Analog Grey Dial Brown Leather Strap Watch for Guys - NT3273NL03,4.3 out of 5 stars,69,£21.24,£26.55,(20% off)
187,Casio,Youth Combination Analog-Digital Black Dial Men's Watch - AEQ-110W-3AVDF (AD223),4.1 out of 5 stars,394,£34.16,£37.95,(10% off)
188,Casio,G-Shock GA-140GB-1A1DR Black & Gold Analog-Digital Dial Black Resin Strap Men's Watch Shock and 200M Water Resistant G1021,4.3 out of 5 stars,261,£86.40,£94.95,(9% off)
189,LOUIS DEVIN,Mesh Steel Chain Analog Wrist Watch for Men (LD-G042),3.8 out of 5 stars,"2,199",£3.13,£18.99,(84% off)
190,Fastrack,Hype All Black Quartz Analog Black Dial with Brown Leather Strap Watch for Unisex,4.2 out of 5 stars,12,£11.92,£13.25,(10% off)
191,Fastrack,Analog Silver Men Watch 3229SM02 / 3229SM02,4.2 out of 5 stars,952,£14.06,£20.66,(32% off)
192,Fastrack,Analog Silver Men Watch 3229SM02 / 3229SM02,4.2 out of 5 stars,952,£14.06,£20.66,(32% off)
193,TIMEX,TIMEX Analog Dial Black Men watch-TWHG35SMU07,4.2 out of 5 stars,407,£17.63,£29.40,(40% off)
194,Noise,"Noise ColorFit Ultra 3 Bluetooth Calling Smart Watch with Biggest 1.96"" AMOLED Display, Premium Metallic Build, Functional Crown, Gesture Control with Metallic Strap (Jet Black: Elite Edition)",4.1 out of 5 stars,"17,946",£28.49,£85.49,(67% off)
195,Titan,Gents Karishma Analog Black Dial Men's Watch NM1825YL01/NN1825YL01/NP1825YL01,4.2 out of 5 stars,298,£22.78,£25.32,(10% off)
196,Helix,by Timex Silver Square Analog Watches for Men | Upto 30 m Water Resistance with Foldover Clasp Closure TW057HG00,5.0 out of 5 stars,1,£9.46,£18.95,(50% off)
197,Fastrack,Analog-Digital Black Dial Men's Watch NL38035SL03/NN38035SL03,4.1 out of 5 stars,722,£37.20,£46.50,(20% off)
198,Titan,Men's Metropolitan Charm: Men's Multifunctional Black Watch with Leather Strap-NS1805SL04/NT1805SL04,4.3 out of 5 stars,125,£50.96,£63.70,(20% off)
199,Noise,"Noise Halo Plus Elite Edition Smartwatch with 1.46"" Super AMOLED Display, Stainless Steel Finish Metallic Straps, 4-Stage Sleep Tracker, Smart Watch for Men and Women (Elite Blue",4.2 out of 5 stars,"6,075",£33.24,£85.49,(61% off)
200,Fastrack,"Fastrack Magnus FX1 1.38"" Display Metal Case Smart Watch with Single Sync BT Calling, Functional Crown, 100+ Sports Modes, Health Tracking, in-Built Games – Smartwatch for Men (Black)",3.9 out of 5 stars,"3,794",£33.23,£56.99,(42% off)
201,Armani Exchange,Armani Exchange Stainless Steel Analog Black Dial Men's Watch-Ax2164,4.5 out of 5 stars,242,£142.93,£170.95,(16% off)
202,Titan,Titan Neo Analog Blue Dial Men's Watch NM1733KL01/NN1733KL01/NP1733KL01,4.4 out of 5 stars,346,£42.13,£55.34,(24% off)
203,Fastrack,Streetwear Digital Grey Dial Silicone Strap Watch for Men-NS38068PP02,4.4 out of 5 stars,114,£13.63,£17.05,(20% off)
204,Titan,Neo Analog Silver Dial Men's Watch NM1767SL01/NN1767SL01/NP1767SL01,4.1 out of 5 stars,326,£30.36,£37.95,(20% off)
205,Titan,Titan Automatic Silver Dial Brown Leather Strap Watch for Men - NT90110WL03,3.8 out of 5 stars,63,£155.82,£173.14,(10% off)
206,Titan,Black and Gold Silver Dial Analog Stainless Steel Strap Watch for Men-NS1849WM01/NT1849WM01,4.7 out of 5 stars,30,£43.18,£61.70,(30% off)
207,Fastrack,Bare Basics Quartz Analog Silver Dial Black Plastic Strap Watch for Guys - NS3114PP02,4.0 out of 5 stars,"2,572",£9.75,£13.25,(26% off)
208,Fastrack,"Silicone Trendies Analog Black Dial Men's Watch-38057Pp02/Np38057Pp02, Band Color:Black",4.1 out of 5 stars,211,£14.39,£18.00,(20% off)
209,Noise,"NoiseFit Halo 1.43"" AMOLED Display, Bluetooth Calling Round Dial Smart Watch, Premium Metallic Build, Always on Display, Smart Gesture Control, 100 Sports Modes (Jet Black)",4.0 out of 5 stars,"8,347",£28.49,£75.99,(63% off)
210,Titan,Neo Analog Black Dial Men's Watch NM1698BM01/NN1698BM01/NP1698BM01,4.2 out of 5 stars,109,£53.91,£67.40,(20% off)
211,Fastrack,Tick Tock Quartz Multifunction Black Dial Black Metal Strap Watch for Guys – NT3287NM01,4.2 out of 5 stars,138,£28.83,£36.05,(20% off)
212,Tommy Hilfiger,Analog Blue Dial Men's Casual Watch,4.2 out of 5 stars,11,£51.29,£85.49,(40% off)
213,Fossil,Bannon Analog Black Dial Men's Watch-BQ2494,4.0 out of 5 stars,103,£96.39,£137.70,(30% off)
214,Fastrack,Hitlist Quartz Analog Black Dial Black Stainless Steel Strap Watch for Guys - NT3039NM02,4.2 out of 5 stars,48,£17.24,£24.65,(30% off)
215,Fastrack,Analog Black Dial Men's Watch-1474NP01/NP1474NP01,4.2 out of 5 stars,119,£26.17,£32.73,(20% off)
216,TIMEX,Men Analogue Black Round Dial Watch - TW000R425,4.3 out of 5 stars,930,£26.79,£27.03,(1% off)
217,LOUIS DEVIN,Mesh Steel Chain Analog Wrist Watch for Men (LD-G042),3.8 out of 5 stars,"2,199",£3.13,£18.99,(84% off)
218,Titan,Classique Analog White Dial Men's Watch NM90102WL01/NN90102WL01/NP90102WL01/NQ90102WL01,4.2 out of 5 stars,250,£92.29,£115.38,(20% off)
219,Fire-Boltt,"Fire-Boltt Ninja Call Pro Plus Smart Watch 1.83 inch with Bluetooth Calling, AI Voice Assistance, 100 Sports Modes IP67 Rating, 240 * 280 Pixel High Resolution (Black)",3.9 out of 5 stars,"95,014",£13.29,£189.99,(93% off)
220,Fire-Boltt,"Fire-Boltt Phoenix Smart Watch with Bluetooth Calling 1.38,120+ Sports Modes, 240 * 240 PX High Res with SpO2, Heart Rate Monitoring & IP67 Rating (Black)",3.9 out of 5 stars,"81,935",£13.29,£94.99,(86% off)
221,Fastrack,Fastrack Mens Pulse Quartz Analog Black Dial with Black Stainless Steel Strap Watch for Guys-1474NM02/NT1474NM02,3.7 out of 5 stars,13,£33.30,£37.00,(10% off)
222,Casio,G-Shock GA-140GB-1A1DR Black & Gold Analog-Digital Dial Black Resin Strap Men's Watch Shock and 200M Water Resistant G1021,4.3 out of 5 stars,261,£86.40,£94.95,(9% off)
223,Fire-Boltt,Fire-Boltt Dominion,3.5 out of 5 stars,207,£22.14,£199.50,(89% off)
224,Casio,Unisex Vintage AQ-230A-2A1MQYDF Blue Analog-Digital Dial Silver Stainless Steel Band Ad270,3.7 out of 5 stars,53,£33.20,£17.09,(20% off)
225,Titan,Neo Splash Quartz Multifunction Midnight Blue Dial Metallic Blue Stainless Steel Strap Watch for Men - NT1805QM01,4.2 out of 5 stars,388,£64.55,£75.95,(15% off)
226,Casio,Edifice EFR-526D-2AVUDF Analog Blue Dial Men Watch Silver Stainless Steel Strap (ED613),5.0 out of 5 stars,1,£73.44,£80.70,(9% off)
227,LOUIS DEVIN,WT030 Leather Strap Analog Wrist Watch for Men,3.7 out of 5 stars,"3,423",£2.84,£20.89,(86% off)
228,Redmi,"Redmi Watch 5 Lite, 1.96 Amoled, Advanced in-Built GPS, 5 ATM, 18 Day Battery, Bluetooth Calling with AI Noise Reduction, Always on Display, Black",4.1 out of 5 stars,537,£33.24,£66.49,(50% off)
229,Titan,Neo Economy Analog Red Dial Men's Watch 1802SL06/NN1802SL06/NP1802SL06,4.2 out of 5 stars,190,£16.68,£18.95,(12% off)
230,Sonata,Smart Plaid Quartz Analog Black Dial Stainless Steel Strap Watch for Men-NR77105SM02W/NT77105SM02W,4.4 out of 5 stars,510,£11.26,£17.09,(20% off)
231,boAt,"boAt New Launch Storm Infinity w/15 Days Extensive Battery fueled by Huge 550mAh Battery, Fast Charge, 1.83”(4.65cm)HD Display, Functional Crown, BT Calling, Smart watch for Men & Women (Active Black)",3.8 out of 5 stars,468,£14.24,£56.99,(75% off)
232,LOUIS DEVIN,Stainless Steel Chain Analog Wrist Watch for Men (Blue/Green/Silver/Black Dial) | LD-G071-CH,3.6 out of 5 stars,30,£3.41,£18.99,(82% off)
233,SKMEI,"New Car Wheel Watch with Rolling Creative Fashion Analog Watch, Black Dial Zink Alloy Case Men's Watch, Stainless Steel Black Color Band, Quartz Movement, Water & Scratch-Resistant-1990",4.1 out of 5 stars,"2,174",£17.08,£73.14,(77% off)
234,Titan,Neo Splash Brown Dial Analog with Date Stainless Steel Strap Watch for Men-1806QM03,4.1 out of 5 stars,32,£45.55,£56.95,(20% off)
235,Sonata,SF Digital Dial Plastic Strap Watch for Men-NS77073PP02/NT77073PP02,4.3 out of 5 stars,"1,567",£6.60,£17.09,(20% off)
236,Casio,Edifice EFR-552D-2AVUDF Analog Blue Dial Men Watch Silver Stainless Steel Strap (ED615),5.0 out of 5 stars,9,£80.70,£17.09,(20% off)
237,Fastrack,Neon Quartz Analog Black Dial Black Silicon Strap Watch for Unisex - NT38003PP13W,4.2 out of 5 stars,"3,969",£7.05,£7.84,(10% off)
238,Armani Exchange,Stainless Steel Analog Blue Dial Men's Watch-AX2457,4.5 out of 5 stars,2,£227.95,£17.09,(20% off)
239,Tommy Hilfiger,Silicone Analog Bank White Men Watch Th1791778/Ncth1791778,4.2 out of 5 stars,28,£144.88,£17.09,(20% off)
240,Casio,Edifice EFR-526D-2AVUDF Analog Blue Dial Men Watch Silver Stainless Steel Strap (ED613),5.0 out of 5 stars,1,£73.44,£80.70,(9% off)
241,Noise,"Noise Pulse Go Buzz Smart Watch with Advanced Bluetooth Calling, 1.69"" TFT Display, SpO2, 100 Sports Mode with Auto Detection, Upto 7 Days Battery (2 Days with Heavy Calling) - Jet Black",4.0 out of 5 stars,"19,686",£12.34,£47.49,(74% off)
242,LONGBO,Men's Watches Luxury Fashion Casual Dress Waterproof Quartz Wristwatches for Men Stainless Steel Band | Birthday Anniversary Gift for Men,3.5 out of 5 stars,69,£11.30,£18.99,(40% off)
243,Titan,Maritime Analog Green Dial Men's Watch NM1830KL02/NN1830KL02/NP1830KL02,4.3 out of 5 stars,148,£139.03,£173.80,(20% off)
244,LOUIS DEVIN,WT030 Leather Strap Analog Wrist Watch for Men,3.7 out of 5 stars,"3,423",£2.84,£20.89,(86% off)
245,LOUIS DEVIN,WT030 Stainless Steel Chain Analog Wrist Watch for Men,3.8 out of 5 stars,295,£3.41,£22.79,(85% off)
246,Fire-Boltt,"Fire-Boltt Rise Smart Watch, 1.85"" HD Display, Metal Body with Bluetooth Calling, Rotating Crown, AI Voice Assistant, 120 Sports Modes, Neon UI, SpO2 & Heart Rate Monitoring (Black-C)",3.7 out of 5 stars,"1,764",£12.34,£142.49,(91% off)
247,Sonata,Smart Plaid Quartz Analog Black Dial Stainless Steel Strap Watch for Men-NR77105SM02W/NT77105SM02W,4.4 out of 5 stars,510,£11.26,£17.09,(20% off)
248,Noise,"Noise ColorFit Pulse 3 with 1.96"" Biggest Display Bluetooth Calling Smart Watch, Premium Build, Auto Sport Detection & 170+ Watch Faces Smartwatch for Men & Women - Midnight Black",4.0 out of 5 stars,"4,374",£13.29,£66.49,(80% off)
249,Titan,Neo Economy Analog Red Dial Men's Watch 1802SL06/NN1802SL06/NP1802SL06,4.2 out of 5 stars,190,£16.68,£18.95,(12% off)
250,Noise,"Noise Pulse 2 Max 1.85"" Display, Bluetooth Calling Smart Watch, 10 Days Battery, 550 NITS Brightness, Smart DND, 100 Sports Modes, Smartwatch for Men and Women (Midnight Blue)",4.0 out of 5 stars,"17,624",£13.29,£56.99,(77% off)
251,LOUIS DEVIN,Stainless Steel Chain Analog Wrist Watch for Men (Blue/Green/Silver/Black Dial) | LD-G071-CH,3.6 out of 5 stars,30,£3.41,£18.99,(82% off)
252,SKMEI,"New Car Wheel Watch with Rolling Creative Fashion Analog Watch, Black Dial Zink Alloy Case Men's Watch, Stainless Steel Black Color Band, Quartz Movement, Water & Scratch-Resistant-1990",4.1 out of 5 stars,"2,174",£17.08,£73.14,(77% off)
253,Titan,Neo Splash Brown Dial Analog with Date Stainless Steel Strap Watch for Men-1806QM03,4.1 out of 5 stars,32,£45.55,£56.95,(20% off)
254,Fastrack,"Fastrack New Limitless Classic|Large 1.91"" Super UltraVU Display|Functional Crown|Highest 320x385 Pixel Resolution|SingleSync BT Calling|100+ Sports Modes|Metal Case Premium Smartwatch - Black Mesh",3.9 out of 5 stars,"7,544",£19.94,£56.95,(65% off)
255,Casio,Edifice EFR-552D-2AVUDF Analog Blue Dial Men Watch Silver Stainless Steel Strap (ED615),5.0 out of 5 stars,9,£80.70,£17.09,(20% off)
256,Fastrack,"Fastrack Radiant FX2 2.04"" AMOLED Smart Watch with BT Calling, Voice Assistant, Functional Crown, Metal Alloy Case, 100+ Sports Modes, SpO2, AOD – Smartwatch for Men and Women (Black)",3.9 out of 5 stars,"3,794",£44.64,£94.95,(53% off)
257,Fastrack,Neon Quartz Analog Black Dial Black Silicon Strap Watch for Unisex - NT38003PP13W,4.2 out of 5 stars,"3,969",£7.05,£7.84,(10% off)
258,Noise,"Noise Pulse 2 Max 1.85"" Display, Bluetooth Calling Smart Watch, 10 Days Battery, 550 NITS Brightness, Smart DND, 100 Sports Modes, Smartwatch for Men and Women (Rose Pink)",4.0 out of 5 stars,"17,624",£13.29,£56.99,(77% off)
259,Armani Exchange,Stainless Steel Analog Blue Dial Men's Watch-AX2457,4.5 out of 5 stars,2,£227.95,£17.09,(20% off)
260,Tommy Hilfiger,Silicone Analog Bank White Men Watch Th1791778/Ncth1791778,4.2 out of 5 stars,28,£144.88,£17.09,(20% off)
261,boAt,"boAt Lunar Embrace w/Vibrant 1.51"" (3.8 cm) AMOLED Display,Premium Metal Design, Functional Crown, 100+ Sports Mode, Animated Watch Faces, Built-in Games, Smart Watch for Men & Women(Steel Black)",4.2 out of 5 stars,298,£33.24,£132.99,(75% off)
262,Fossil,Grant Chronograph Beige Dial Men's Watch - FS4735,4.2 out of 5 stars,263,£123.45,£17.09,(20% off)
263,Sonata,Quartz Analog Black Dial Plastic Strap Watch for Men-NS77085PP03W/NT77085PP03W,4.0 out of 5 stars,129,£7.08,£17.09,(20% off)
264,LOUIS DEVIN,Leather Strap Analog Wrist Watch for Men,3.6 out of 5 stars,679,£2.84,£22.79,(88% off)
