,Brand Name,Product Name,Rating,Rating Count,Selling Price,MRP,Offer
181,AKHILAM,Women's Bhagalpuri Silk Geometric Printed Ready To Wear one Minute Saree With Unstitched Blouse Piece,3.6 out of 5 stars,40,£7.59,£29.44,(74% off)
182,Generic,Praiso Mart - Women's Silk Saree with Rich Pallu & Blouse Piece,4.0 out of 5 stars,1,£9.49,£28.49,(67% off)
183,SIRIL,Women's Printed Cotton Linen One Minute Ready to Wear Saree with Pocket & Unstitched Blouse Piece,4.0 out of 5 stars,1,£9.10,£37.99,(76% off)
184,SIRIL,Women's Cotton Linen Printed Saree With Unstitched Blouse Piece,5.0 out of 5 stars,2,£7.59,£32.29,(76% off)
185,RANI SAAHIBA,Women's Chiffon Lehriya Printed Saree Without Blouse,4.0 out of 5 stars,141,£5.60,£18.99,(71% off)
186,SIRIL,Women's Floral Printed Georgette Saree With Unstitched Blouse Piece,3.7 out of 5 stars,317,£4.74,£23.03,(79% off)
187,SIRIL,Women's Printed Cotton Saree with Unstitched Blouse Piece,3.7 out of 5 stars,90,£6.36,£27.37,(77% off)
188,Satrani,Women's Banarasi Silk Weaving Stone Work Saree with Unstitched Blouse Piece,4.7 out of 5 stars,4,£9.02,£25.74,(65% off)
189,SIRIL,Women's Paithani Silk Saree | Chandrakor Paithani Saree With Unstitched Blouse Piece,4.2 out of 5 stars,33,£7.58,£30.39,(75% off)
190,Yashika,Women's Art Silk Kalamkari Bhagalpuri and Kashmiri Style Soft Saree with Blouse Piece (Golden Peacock_Y),4.1 out of 5 stars,31,£2.56,£17.09,(85% off)
191,SIRIL,Women's Georgette Bandhani Printed Saree With Unstitched Blouse Piece,1.0 out of 5 stars,1,£8.54,£34.19,(75% off)
192,SIRIL,Women's Jacquard Banarasi Soft Silk Saree Pure Silk Kanjivaram With Unstitched Blouse Piece,5.0 out of 5 stars,16,£7.58,£31.34,(76% off)
193,SIRIL,Women's Cotton Printed Saree With Unstitched Blouse Piece,3.4 out of 5 stars,137,£3.41,£13.12,(74% off)
194,Yashika,Women's Trendy Georgette Red Color Saree with Blouse Material,3.4 out of 5 stars,29,£2.56,£17.09,(85% off)
195,C J Enterprise,Women's Banarasi Pure Soft Kanjivaram Silk Saree With Blouse Piece For Wedding (Champa-51),3.7 out of 5 stars,153,£5.98,£9.49,(37% off)
196,SIRIL,Women's Georgette Printed Saree With Unstitched Blouse Piece Combo Pack Of 2,3.5 out of 5 stars,359,£4.73,£22.13,(79% off)
197,Yashika,Women's Printed Georgette Saree With Lace Border and Unstitched Blouse Material,4.5 out of 5 stars,2,£3.79,£17.09,(78% off)
198,SIRIL,Women's Chiffon Printed Saree with Blouse Piece,3.6 out of 5 stars,482,£4.43,£19.86,(78% off)
199,Mehrang,Cotton Banarasi Silk Saree for Women With Unstitched Blouse Piece,4.2 out of 5 stars,326,£16.14,£37.99,(58% off)
200,TRENDMALLS,Women's Net Sequin Embroidery Zarkan Work Saree with Unstitch Blouse Piece,4.6 out of 5 stars,6,£33.43,£99.27,(66% off)
201,Yashika,Plain Women's Trendy Cotton Silk Color Saree with Blouse Material(SUHALI Peach),3.5 out of 5 stars,282,£4.70,£17.09,(72% off)
202,AKHILAM,Women's Chiffon Woven Border Saree with Unstitched Blouse Piece,3.5 out of 5 stars,172,£2.84,£16.62,(83% off)
203,AKHILAM,Women's Satin Silk Ajrak Printed Saree With Unstitched Blouse Piece (PURAJRKH001A_RJ_Parent),4.7 out of 5 stars,4,£9.49,£36.57,(74% off)
204,SIRIL,Women's Printed Cotton Linen One Minute Ready to Wear Saree with Unstitched Blouse Piece,3.5 out of 5 stars,16,£8.53,£36.09,(76% off)
205,Yashika,Women's Banarasi Kanjivaram Cotton Silk Woven Saree with Unstitched Blouse Material,4.8 out of 5 stars,27,£4.74,£17.09,(72% off)
206,Satrani,Women's Silk Paithani Jacquard Weaving Saree with Unstitched Blouse Piece,4.4 out of 5 stars,36,£6.64,£20.32,(67% off)
207,Yashika,Women's Tussar Silk Printed Saree With Blouse Material |saree for Women | saree collection 2025 | New Sari | Latest Saree,5.0 out of 5 stars,5,£3.78,£17.09,(78% off)
208,Yashika,Women's Banarasi Kanjivaram Cotton Silk Woven Saree with Unstitched Blouse Material,4.8 out of 5 stars,46,£4.74,£17.09,(72% off)
209,SIRIL,Women's Printed Silk Saree with Unstitched Blouse Piece,4.3 out of 5 stars,68,£4.70,£20.43,(77% off)
210,Yashika,Women's Plain Digital Print Art Silk Cotton Saree with Tassels Golden Border-Lightweight Elegant Ethnic Wear for Festive and Casual Occasions,4.0 out of 5 stars,19,£4.74,£17.09,(72% off)
211,SIRIL,Women's Bagalpuri Silk Saree | Varli Printed Saree With Unstitched Blouse Piece,3.5 out of 5 stars,10,£4.64,£19.94,(77% off)
212,Shiv Textiles,Women's Banarasi Silk Saree,3.9 out of 5 stars,"3,501",£6.36,£12.34,(48% off)
213,SIRIL,Women's Banarasi Soft Silk Saree Pure Silk with Unstitched Blouse Piece,4.1 out of 5 stars,77,£4.44,£21.89,(80% off)
214,Shiv Textiles,Shiv Textiles Women's Pure Georgette Saree With Blouse Piece,3.8 out of 5 stars,"1,735",£4.55,£14.24,(68% off)
215,SAREE MALL,Women's Cotton Ikat Printed Ready To Wear one Minute Saree With Blouse Piece,3.9 out of 5 stars,16,£8.07,£30.87,(74% off)
216,AKHILAM,Women's Shimmer Net Solid Saree With Unstitched Blouse Piece,4.6 out of 5 stars,8,£8.54,£33.72,(75% off)
217,TRENDMALLS,Women's Pure Silk Embroidery Work Saree with Unstitch Blouse Piece,4.6 out of 5 stars,8,£34.10,£93.09,(63% off)
218,SIRIL,Women's Georgette Hot Fixing Stone Work Saree With Unstitched Blouse Piece,4.9 out of 5 stars,28,£6.17,£37.99,(84% off)
219,TRENDMALLS,Women's Jacquard Silk Embroidery Saree with Unstitched Blouse Piece (K1178-Yellow),4.0 out of 5 stars,1,£43.08,£142.49,(70% off)
220,Yashika,Women's Banarasi Kanjivaram Art Silk Saree with Blouse Material,4.9 out of 5 stars,31,£5.69,£17.09,(67% off)
221,Yashika,Women's Banarasi Kanjivaram Cotton Silk Jaquard Saree,4.0 out of 5 stars,246,£6.64,£17.09,(61% off)
222,SGF11,Women's Paithani Soft Lichi Silk Kanjivaram Sarees With Blouse Piece,4.1 out of 5 stars,406,£15.18,£85.49,(82% off)
223,SIRIL,Women's Floral Printed Silk Crepe Saree with Unstitched Blouse Piece,4.1 out of 5 stars,126,£8.07,£33.43,(76% off)
224,Yashika,Women's Dimond Chiffon Rangoli Silk Stunning Swarovski Stone Set with Blouse for Wome New Sari | Latest Saree,4.4 out of 5 stars,112,£7.59,£17.09,(56% off)
225,Satrani,Women's Georgette Embroidery & Stone Work Saree with Unstitched Blouse Piece,4.4 out of 5 stars,6,£5.69,£20.32,(72% off)
226,VAIRAGEE,Women Beautiful soft Silk Embroidery Work Saree with blouse piece(6093),4.3 out of 5 stars,24,£13.29,£43.98,(70% off)
227,SIRIL,Women's Cotton Printed Zari Stripe Saree With Unstitched Blouse Piece,3.5 out of 5 stars,122,£4.74,£17.50,(73% off)
228,SAMAH,Women's Art Silk Banarasi Jacquard Saree with Unstitched Blouse Piece,4.0 out of 5 stars,80,£4.74,£17.27,(73% off)
229,SIRIL,Women's Printed Silk Saree with Blouse,3.4 out of 5 stars,"3,640",£3.20,£13.12,(76% off)
230,Yashika,Women's Printed Georgette Saree With Lace Border and Unstitched Blouse Material,4.3 out of 5 stars,22,£3.79,£17.09,(78% off)
231,dB DESH BIDESH,Women's Shakuntala Design Printed Tant Handloom Pure Cotton Saree Without Blouse Piece,3.7 out of 5 stars,530,£4.74,£18.93,(75% off)
232,Pujia Mills,woman Pure Paithani Silk Banarasi Saree Indian Ethnic wear latest kanjivaram banarasi saree in 2025 woven gold zari heavy border with rich pallu and butti work pink saree for woman,4.5 out of 5 stars,2,£25.45,£66.50,(62% off)
233,SIRIL,Women's Kanjivaram Soft Silk Saree with Unstitched Blouse Piece,4.1 out of 5 stars,9,£4.70,£25.54,(82% off)
234,Yashika,Women's Banarasi Kanjivaram Jacquard Art Silk Saree - Exquisite Ethnic Attire for Indian Festivities - Unstitched Blouse Included,3.8 out of 5 stars,222,£4.27,£17.09,(75% off)
235,SIRIL,Women's Kanjivaram Soft Silk Saree Pure Silk with Unstitched Blouse Piece,3.5 out of 5 stars,6,£4.73,£23.74,(80% off)
236,SIRIL,Women's Silk Printed Saree With Blouse,3.4 out of 5 stars,331,£3.32,£13.53,(75% off)
237,Glory Sarees,Women's Banarasi Artificial Silk Saree With Blouse Piece,3.7 out of 5 stars,"1,402",£8.26,£47.49,(83% off)
238,SIRIL,Women's Floral Printed Chiffon Saree with Unstitched Blouse Piece,3.0 out of 5 stars,14,£4.73,£24.69,(81% off)
239,SIRIL,Women's Banarasi Silk Saree Pure Silk Saree With Unstitched Blouse Piece,3.8 out of 5 stars,53,£6.17,£24.08,(74% off)
240,TRENDMALLS,Women's Chanderi Silk Siroski Work Saree with Unstitch Blouse Piece (K1152-Orange),5.0 out of 5 stars,1,£25.64,£83.59,(69% off)
241,AKHILAM,Women's Georgette Floral Printed Saree With Unstitched Blouse Piece(DIPIKA102_SU_Parent),4.3 out of 5 stars,52,£9.02,£33.24,(73% off)
242,AKHILAM,Women's Solid Embellished Georgette Saree With Unstitched Blouse Piece,3.6 out of 5 stars,115,£4.74,£29.73,(84% off)
243,Yashika,Women's Banarasi Kanjivaram Cotton Silk Saree With Unstitched Blouse Material,4.6 out of 5 stars,42,£7.59,£17.09,(56% off)
244,Flosive,Women's Thread Sequence Work Georgette Saree With Blouse,3.6 out of 5 stars,126,£12.34,£42.75,(71% off)
245,Satrani,Women's Chiffon Bandhani Printed Weaving Border Saree with Unstitched Blouse Piece,4.7 out of 5 stars,4,£7.59,£24.41,(69% off)
246,SAMAH,Women's Bhagalpuri Silk Blend Printed Saree with Unstitched Blouse Piece,4.4 out of 5 stars,13,£4.36,£12.44,(65% off)
247,EthnicJunction,Women's Silk Blend Woven Banarasi Saree With Blouse Piece,3.6 out of 5 stars,37,£6.81,£34.16,(80% off)
248,SIRIL,Women's Pure Cotton Printed Saree With Unstitched Blouse Piece,4.4 out of 5 stars,3,£6.82,£29.19,(77% off)
249,SIRIL,Women's Georgette Bandhani Printed Saree With Unstitched Blouse Piece,4.3 out of 5 stars,6,£7.58,£30.39,(75% off)
250,SIRIL,Women's Georgette Sequence Embroidery Lace Saree With Unstitched Blouse Piece,3.1 out of 5 stars,34,£8.54,£40.67,(79% off)
251,C J Enterprise,Women's Pure Kanjivaram Silk Saree Soft Paithani Wedding Sarees With Blouse Piece (Nath paithani),3.7 out of 5 stars,26,£5.69,£9.49,(40% off)
252,Yashika,Women's Fancy Banarasi Kanjivaram Art Silk Saree with Blouse Pieces||Mint Green Coloured Kanjivaram Saree|| AZ-YS-OG-SARKAR BLUE,3.4 out of 5 stars,4,£5.69,£17.09,(67% off)
253,SIRIL,Women's Georgette Printed Zari Striped One Minute Saree Ready to Wear With Unstitched Blouse Piece,3.7 out of 5 stars,492,£7.78,£30.29,(74% off)
254,Generic,Anka's Handmade Bharatanatyam & Kuchipudi Dance Practice Cotton Saree (Red With Black&Gold Colour Rudrakshi Border),4.0 out of 5 stars,1,£7.59,£11.39,(33% off)
255,AKHILAM,Women's Georgette Floral Printed Saree With Unstitched Blouse Piece(DIPIKA102_SU_Parent),4.3 out of 5 stars,52,£9.02,£33.24,(73% off)
256,MIRCHI FASHION,Women's Plain Weave Chiffon Abstrect Printed Saree with Blouse Piece,3.8 out of 5 stars,396,£4.46,£2.53,(83% off)
257,Avantika Fashion,Women's Kanjivaram Soft Silk Banarasi Sarees With Blouse Piece,4.0 out of 5 stars,96,£8.01,£23.74,(66% off)
258,C J Enterprise,Women's Banarasi Saree Pure Kanjivaram Style Silk Saree With Blouse Piece for Wedding (Shiv-1),4.1 out of 5 stars,23,£5.22,£9.49,(45% off)
259,TRENDMALLS,Women's Pure Silk Embroidery Work Saree with Unstitch Blouse Piece,4.6 out of 5 stars,8,£34.10,£93.09,(63% off)
260,BENGAL HANDLOOM,Exclusive Women's Cotton Silk Dhakai Allover Soft Jamdani Sarees,3.6 out of 5 stars,211,£7.25,£44.17,(84% off)
261,Bee M Pee Designer,Chiffon Brasso Sarees for Women,3.3 out of 5 stars,117,£6.64,£23.74,(72% off)
262,MIRCHI FASHION,Women's Stylish Chiffon Leaf Printed Saree with Blouse Piece,4.0 out of 5 stars,858,£4.46,£3.62,(83% off)
263,MIRCHI FASHION,Women's Chiffon Floral Printed Saree with Blouse Piece,4.0 out of 5 stars,147,£4.46,£2.74,(83% off)
264,Sugathari,Women's Banarasi Saree Pure Kanjivaram Silk Saree Soft new ladies 2023 Design Wear Pattu Sarees Latest Cotton Party Sari collections With Blouse Piece for Wedding sadi (SAM PARI-100),4.1 out of 5 stars,178,£4.74,£23.74,(80% off)
265,SGF11,Women's Kanjivaram Pure Soft Silk Handloom Saree Pure Golden Zari With Blouse Piece,4.1 out of 5 stars,870,£14.23,£85.49,(83% off)
266,Sugathari,Women's Banarasi Saree Pure Kanjivaram Silk Saree Soft new ladies 2023 Design Wear Pattu Sarees Latest Party Sari collections With Blouse Piece for Wedding sadi (SAM PARI S-6),4.0 out of 5 stars,109,£5.22,£21.84,(76% off)
267,Sugathari,Women's Banarasi Saree Pure Kanjivaram Silk Saree Soft new ladies 2023 Design Wear Pattu Sarees Latest Cotton Party Sari collections With Blouse Piece for Wedding sadi (PARI 63 NEW WINE),4.0 out of 5 stars,154,£4.74,£23.74,(80% off)
268,RATAN,Women's Chiffon Bandhani Printed Saree without Blouse Piece,3.7 out of 5 stars,59,£4.76,£18.99,(75% off)
269,SIRIL,Women's Shimmer Chiffon Sequence Embroidery Saree for Wedding Parties With Unstitched Blouse Piece,3.8 out of 5 stars,7,£12.33,£53.19,(77% off)
270,Yashika,Women's Woven Latest Art Silk and Tassels Saree with Unstitched Blouse Material,4.4 out of 5 stars,40,£3.79,£17.09,(78% off)
271,AKHILAM,Women's Cotton Geometric Printed Saree With Unstitched Blouse Piece (PUMPUM15_SR_Parent),4.0 out of 5 stars,1,£9.02,£37.04,(76% off)
272,dB DESH BIDESH,Women`s Resham Dhakai Jamdani Bengal Pure Cotton Handloom Saree Diamond Queen Design,3.6 out of 5 stars,90,£4.74,£28.49,(83% off)
273,EthnicJunction,Women's Silk Blend Woven Paithani Saree With Blouse Piece,3.8 out of 5 stars,19,£7.48,£37.96,(80% off)
274,dB DESH BIDESH,Women`s Tant Cotton Silk Handloom Cotton Blend Saree Floral Leaf Design With Blouse Piece,3.6 out of 5 stars,57,£7.13,£39.89,(82% off)
275,Maxis,Women's Kasavu Cotton Saree With Blouse Piece (SMALLPCK_RCHPALLU_Cream),3.9 out of 5 stars,223,£8.44,£12.34,(32% off)
276,EthnicJunction,Women's Pure Cotton Woven Saree With Blouse Piece,3.7 out of 5 stars,77,£6.32,£34.16,(82% off)
277,Glory Sarees,Women's Woven Pure Soft Kanjivaram Silk Saree Banarasi Style With Blouse Piece for Wedding,3.9 out of 5 stars,"7,417",£4.74,£37.99,(88% off)
278,SIRIL,Women's Jari Border & Mukaish Work Chiffon Saree with Unstitched Blouse Piece,3.6 out of 5 stars,206,£3.78,£13.53,(72% off)
279,RANI SAAHIBA,Women's Chiffon Lehriya Printed Saree Without Blouse,3.8 out of 5 stars,86,£4.65,£19.94,(77% off)
280,Yashika,Women's Printed Kalamkari Art Silk Saree With Tassels and Unstitched Blouse Material,4.5 out of 5 stars,46,£3.78,£17.09,(78% off)
281,EthnicJunction,"Women's Art Silk Kalamkari Print Saree With Blouse Piece,black",4.4 out of 5 stars,28,£3.47,£15.76,(78% off)
282,Yashika,Women's Trendy Cotton Silk Saree with Blouse Material|| Pongal Special South Indian kerala Saree With Blouse Piece||(AZ-YS-OG-PONGAL ONAM-P),3.4 out of 5 stars,18,£3.41,£18.99,(82% off)
283,TRENDMALLS,Women's Georgette Sequence Embroidery Work Saree with Blouse Piece,3.8 out of 5 stars,80,£14.81,"£1,481.05",(74% off)
284,SIRIL,Women's Pure Cotton Printed Ready To Wear Pocket Saree With Unstitched Blouse Piece,4.0 out of 5 stars,1,£9.30,£37.99,(76% off)
285,dB DESH BIDESH,Women`s Handloom Pure Cotton Saree Abhiprithi Design Without Blouse Piece,3.9 out of 5 stars,62,£4.74,£21.84,(78% off)
286,RANI SAAHIBA,Women's Chiffon Saree without Blouse Piece,3.6 out of 5 stars,792,£4.74,£19.94,(76% off)
287,VJ Fashion,Women Cotton Silk Zari Border Saree With Blouse Piece_Freesize,3.5 out of 5 stars,349,£2.67,£9.49,(72% off)
288,MIRCHI FASHION,Women's Chiffon Floral Printed Saree with Blouse Piece,3.9 out of 5 stars,98,£4.55,£3.38,(83% off)
289,Yashika,Women's Elegant Chiffon Saree Set with Blouse Piece - Elevate Your Style with This Trendy Ensemble!,4.0 out of 5 stars,179,£3.77,£17.09,(78% off)
290,SIRIL,Women's Net Pearl Work Saree With Unstitched Blouse Piece,3.5 out of 5 stars,34,£3.60,£18.23,(80% off)
291,SIRIL,Women's Pure Cotton Saree | Printed Ready To Wear One Minute Pleated Saree With Unstitched Blouse Piece,3.7 out of 5 stars,4,£9.10,£37.04,(75% off)
292,Satrani,Women's Organza Zari Stripe Jacquard Border Saree with Unstitched Blouse Piece,4.9 out of 5 stars,22,£5.69,£21.65,(74% off)
293,Yashika,Womens Georgette Printed Saree With Blouse Piece(AAYUSHI BLACK_N_Free Size),3.1 out of 5 stars,6,£2.56,£17.09,(85% off)
294,C J Enterprise,Women’s Pure Soft Cotton Saree Linen For Silk Sarees Latest Party Design Wear Kalamkari Wedding Sadi With Blouse Piece Sari South Mulmul ikkat Mul Print 2025 New (White Lotus Yellow),4.0 out of 5 stars,13,£8.54,£9.49,(10% off)
295,SIRIL,Women's Banarasi Soft Silk Saree Pure Silk with Unstitched Blouse Piece,1.0 out of 5 stars,1,£4.70,£23.74,(80% off)
296,Yashika,Georgette Women Saree,4.5 out of 5 stars,5,£2.56,£17.09,(85% off)
297,TRENDMALLS,Women's Chanderi Silk Siroski Work Saree with Unstitch Blouse Piece (K1152-Orange),5.0 out of 5 stars,1,£25.64,£83.59,(69% off)
298,Yashika,Women's Fancy Banarasi Kanjivaram Art Silk Saree with Blouse Pieces||Mint Green Coloured Kanjivaram Saree|| AZ-YS-OG-SARKAR BLUE,3.4 out of 5 stars,4,£5.69,£17.09,(67% off)
299,Yashika,Women's Woven Printed Art Silk Saree with Unstitched Blouse Material,3.8 out of 5 stars,38,£2.56,£17.09,(85% off)
300,Sidhidata,Women's Georgette Digital Printed Ready To Wear one Minute Saree With Unstitched Blouse Piece,3.7 out of 5 stars,"1,811",£9.49,£28.49,(67% off)
301,Sugathari,Women's Pure Kanjivaram Silk Saree Banarasi Silk Saree With Blouse Piece (SAM PARI S-7),4.0 out of 5 stars,154,£4.74,£21.84,(78% off)
302,C J Enterprise,Women's Pure Soft Kanjivaram Silk Saree Banarasi Design Style With Blouse Piece for Wedding (Pari9016-51),4.1 out of 5 stars,766,£4.90,£9.49,(48% off)
303,SGF11,Women's Paithani Soft Lichi Silk Kanjivaram Sarees With Blouse Piece,4.0 out of 5 stars,57,£14.23,£85.49,(83% off)
304,SIRIL,Women's Printed Silk Saree with Unstitched Blouse Piece,4.3 out of 5 stars,68,£4.70,£20.43,(77% off)
305,Yashika,Women's Art Silk Saree Plain Standard Length,3.6 out of 5 stars,606,£2.56,£17.09,(85% off)
306,SIRIL,Women's Pure Cotton Batik Printed Ready To Wear Saree With Unstitched Blouse Piece,2.1 out of 5 stars,3,£9.11,£37.99,(76% off)
307,Yashika,Women's Trendy Printed Jacquard Lace Georgette Saree with Blouse Material||AZ-YS-P1-GULSHAN-Parent,3.6 out of 5 stars,97,£3.41,£17.09,(80% off)
308,SIRIL,Women's Georgette Embroidery Zari Work Saree With Unstitched Blouse Piece,4.0 out of 5 stars,85,£12.34,£56.60,(78% off)
309,ZECVA,Women's Pure Spun Linen Cotton Lichi Silk Saree With Attach Unstitch Blouse Piece,3.9 out of 5 stars,103,£7.53,£56.99,(87% off)
310,C J Enterprise,Women's Pure Kanjivaram Silk Saree Soft Paithani Wedding Sarees With Blouse Piece (Nath paithani),3.7 out of 5 stars,26,£5.69,£9.49,(40% off)
311,C J Enterprise,Women's Pure Kanjivaram Soft Silk Saree Banarasi Style Sarees For Wedding With Blouse Piece (Almari-51),3.9 out of 5 stars,246,£8.54,£9.49,(10% off)
312,Yashika,Women's Crepe Saree,3.6 out of 5 stars,"2,466",£2.56,£11.09,(77% off)
313,TRENDMALLS,Women's Net Sequin Embroidery Zarkan Work Saree with Unstitch Blouse Piece,4.6 out of 5 stars,6,£33.43,£99.27,(66% off)
314,Avantika Fashion,Women's Kanjivaram Soft Pure Silk Saree With Blouse Piece,3.9 out of 5 stars,308,£4.74,£33.24,(86% off)
0,Pinkmint,Men's Regular Fit Soft Cotton Blend Casual Combo Shirt with Pocket Design & Spread Collar Full Sleeves Formal Shirt,3.6 out of 5 stars,939,£3.79,£18.99,(80% off)
1,Park Avenue,Men's Slim Fit Checks Pattern Cotton Polyester Blend Semi Cutaway Collar Full Sleeve Formal Shirt,4.4 out of 5 stars,7,£6.45,£16.14,(60% off)
2,Highlander,Men's Solid Slim Fit Shirt,4.8 out of 5 stars,39,£4.74,£15.19,(69% off)
3,The Indian Garage Co,Men's Cotton Slim Fit Checkered Full Sleeves Cutaway Collar Casual Shirt,3.8 out of 5 stars,15,£4.82,£16.62,(71% off)
4,Hardsoda,by The Indian Garage Co Men Plus Size Regular Fit Solid Cutaway Collar Full Sleeves Casual Shirt,4.1 out of 5 stars,28,£7.31,£20.89,(65% off)
5,The Indian Garage Co,Men Cotton Regular Fit Checkered Full Sleeves Cutaway Collar Casual Shirt,4.4 out of 5 stars,5,£5.64,£19.47,(71% off)
6,GODFREY,Casual Shirt for Man,4.1 out of 5 stars,10,£5.69,£18.99,(70% off)
7,The Indian Garage Co,Men Cotton Slim Fit Solid Full Sleeves Mandarin Collar Formal Shirt,5.0 out of 5 stars,3,£5.74,£18.52,(69% off)
8,Allen Solly,Men's Plain Slim Fit Shirt,3.7 out of 5 stars,"16,620",£8.64,£15.19,(43% off)
9,Raymond,Men's Slim Fit Pure Cotton Structure Pattern Semi Cutaway Collar Full Sleeve Formal Shirt,3.6 out of 5 stars,8,£7.59,£18.99,(60% off)
10,Peter England,Men's Classic Checkered Formal Slim Fit Full Sleeve Shirt | Wonder Fabric | Cotton-Rich,4.1 out of 5 stars,318,£6.64,£15.19,(56% off)
11,The Indian Garage Co,Men's Cotton Slim Fit Multi Striped Full Sleeves Cutaway Collar Casual Shirt,3.7 out of 5 stars,"1,481",£4.82,£16.62,(71% off)
12,Raymond,Slim Fit Pure Cotton Solid Pattern Semi Cut Away Collar Formal Shirt,4.2 out of 5 stars,14,£8.33,£20.89,(60% off)
13,Amazon Brand - Symbol,Men's Solid Cotton Formal Shirt | Plain | Full Sleeve - Regular Fit (Available in Plus Size and Combo Packs),4.0 out of 5 stars,"9,157",£5.69,£15.19,(63% off)
14,Allen Solly,Men's Solid Regular Fit Shirt,4.0 out of 5 stars,517,£9.91,£17.09,(42% off)
15,Peter England,Men's Premium Solid Herringbone Regular Fit Full Sleeve Formal Shirt | Wonder Fabric | Cotton Rich,4.0 out of 5 stars,112,£8.54,£15.19,(44% off)
16,CB-COLEBROOK,Men's Regular Fit Solid Soft Touch Cotton Casual Shirt with Pocket Design with Spread Collar & Full Sleeves,3.8 out of 5 stars,"2,400",£4.70,£17.57,(73% off)
17,Amazon Brand - Symbol,Men's Solid Cotton Rich Formal Shirt | Plain | Full Sleeve-Regular Fit (Available in Plus Size and Combo Pack of 2),3.8 out of 5 stars,"13,600",£5.69,£17.09,(67% off)
18,Van Heusen,Solid Formal Shirt for Men| Premium Cotton| Full Sleeves| Slim Fit |Breathable Fabric,3.9 out of 5 stars,"3,277",£9.49,£18.99,(50% off)
19,Pinkmint,Casual Shirt for Men Stylish Men's Shirt Soild Regular Fit Long Sleeve Formal Wear Purple,3.6 out of 5 stars,493,£3.79,£18.99,(80% off)
20,Peter England,Men's Striped Slim Fit Full Sleeve Formal Shirt | Cotton-Rich | Wonder Fabric | Pin-Point Oxford Weave,4.0 out of 5 stars,183,£7.50,£13.29,(44% off)
21,DEELMO,Men's Stylish Solid Satin Casual Shirt for Men Full Sleeves| Poly Satin Silk Shirt,4.0 out of 5 stars,"1,066",£4.74,£17.09,(72% off)
22,Lymio,Regular Fit Shirt for Men|| Men Stylish Regular Fit Shirt (Resort-Slub),4.3 out of 5 stars,171,£4.27,£37.99,(89% off)
23,Van Heusen,Formal Striped Shirt for Men| Premium Cotton| Full Sleeves| Slim Fit |Breathable Fabric,3.9 out of 5 stars,383,£8.56,£18.99,(55% off)
24,Van Heusen,Cotton Men's Solid Regular Fit Formal Shirt (VHSF1M76828_Blue_48),3.8 out of 5 stars,7,£12.82,£22.79,(44% off)
25,Peter England,Men's Cotton Regular Fit Shirt,4.1 out of 5 stars,143,£11.39,£17.09,(20% off)
26,GRECIILOOKS,Shirt for Men | Mens Casual Shirt's | Men's Regular Fit Stylish | Printed | Man's Solid Slim Fit | Short Sleeve | Trendy (Available in Plus Size and Combo Pack of 2),4.2 out of 5 stars,346,£3.79,£18.99,(80% off)
27,Peter England,Men's Everday Regular Fit Solid Shirt | Cotton Rich | 5-Pin Pocketing,4.1 out of 5 stars,715,£7.31,£13.29,(45% off)
28,Van Heusen,Men's Cotton Regular Fit Shirt,3.5 out of 5 stars,6,£9.97,£19.94,(50% off)
29,Van Heusen,Formal Micro Checkered Shirt for Men| Premium Cotton| Full Sleeves| Slim Fit |Breathable Fabric,3.9 out of 5 stars,740,£8.56,£18.99,(55% off)
30,Van Heusen,Formal Checkered Shirt for Men| Premium Cotton| Full Sleeves| Slim Fit |Breathable Fabric,3.9 out of 5 stars,"1,859",£9.49,£18.99,(50% off)
31,Allen Solly,Men's Cotton Classic Fit Checkered Formal Shirt,4.0 out of 5 stars,16,£10.82,£18.99,(43% off)
32,Peter England,Men's Everyday Solid Slim Fit Full Sleeve Formal Shirt | Cotton-Rich,3.9 out of 5 stars,988,£6.64,£13.29,(50% off)
33,Allen Solly,Men's 100% Cotton Regular Fit Shirt,4.1 out of 5 stars,442,£9.11,£17.09,(47% off)
34,Allen Solly,Men's Cotton Classic Fit Solid Textured Formal Shirt,4.2 out of 5 stars,19,£9.68,£18.04,(46% off)
35,Majestic Man,Men Classic Slim Fit Pure Cotton Casual Shirt,3.9 out of 5 stars,622,£4.74,£14.24,(67% off)
36,Park Avenue,Men's Cotton Slim Fit Shirt,4.2 out of 5 stars,30,£8.08,£21.84,(63% off)
37,Peter England,Men's Regular Fit Full Sleeve Striped Formal Shirt | Cotton Rich | Wonder Fabric | Premium Dobby Weave,4.1 out of 5 stars,51,£8.54,£15.19,(44% off)
38,Peter England,Men's Cotton Slim Fit Ditsy Printed Full Sleeve Shirt,4.1 out of 5 stars,381,£8.48,£13.29,(36% off)
39,Majestic Man,Slim Fit Cotton Blend Formal Shirts for Men,3.9 out of 5 stars,961,£4.46,£14.24,(69% off)
40,Scott International,"Shirt for Men, Solid Full Sleeves Shirt, Wrinkle Free Mens Shirts, Cotton Formal Shirts, Regular Fit Stylish Mens Shirt, Plain Formal Shirts for Men",3.8 out of 5 stars,619,£7.12,£16.14,(56% off)
41,Highlander,Men's Slim Fit Shirt,5.0 out of 5 stars,2,£5.22,£17.09,(69% off)
42,Peter England,Men's Slim Fit Full Sleeve Pin-Striped Formal Shirt | Cotton-Rich | Wonder Fabric | Pin Point Oxford,4.2 out of 5 stars,159,£7.50,£13.29,(44% off)
43,IndoPrimo,Men's Casual Solid Satin Shirt for Men Full Sleeves Spread Collared Neck Curved Hem Length | Shirt for Man,4.0 out of 5 stars,564,£3.79,£18.99,(80% off)
44,Allen Solly,Men's Cotton Regular Fit Solid Casual Button Down Collar Shirt,4.0 out of 5 stars,7,£9.13,£18.04,(49% off)
45,Peter England,Men's Striped Slim Fit Shirt,3.9 out of 5 stars,62,£8.54,£15.19,(44% off)
46,Peter England,Men's Micro-Checkered Formal Slim Fit Full Sleeve Shirt | Cotton Rich,4.1 out of 5 stars,182,£11.11,£17.09,(35% off)
47,Allen Solly,Men's Cotton Classic Fit Stripe Formal Shirt,4.3 out of 5 stars,48,£9.11,£17.09,(47% off)
48,Majestic Man,Slim Fit Satin Cotton Formal Shirt for Men,3.9 out of 5 stars,817,£6.26,£14.24,(56% off)
49,Peter England,Men's Slim Fit Full Sleeve Formal Textured Solid Shirt | Festive Duo-Tone Colour | 100% Cotton,4.0 out of 5 stars,128,£7.50,£13.29,(44% off)
