,Brand Name,Product Name,Rating,Rating Count,Selling Price,MRP,Offer
0,C J Enterprise,Women's Kanjivaram Art Silk Saree Soft Banarasi Style Sari With Blouse Piece For Wedding (Pari122-51),4.0 out of 5 stars,"1,177",£4.74,£9.49,(50% off)
1,SGF11,Women's Kanjivaram Soft Silk Saree With Blouse Piece,3.8 out of 5 stars,"1,806",£5.67,£56.99,(90% off)
2,SIRIL,Women's Lace & Printed Chiffon Saree with Blouse,3.8 out of 5 stars,"1,512",£4.73,£33.43,(86% off)
3,SGF11,Women's Kanjivaram Pure Soft Silk Saree For Women Pure Golden Zari With Blouse Piece,4.1 out of 5 stars,162,£12.33,£85.49,(86% off)
4,Sidhidata,Women's Soft Zimmy Choo Fandy Silk Saree With Hand Work Lace Boarder & Comes With Unstitched Blouse Piece (Chhaava),4.5 out of 5 stars,316,£9.48,£28.49,(67% off)
5,AKHILAM,Women's Organza Solid Saree With Unstitched Blouse Piece (RADHA1101_RX_Parent),4.4 out of 5 stars,7,£13.29,£54.62,(76% off)
6,Yashika,Womens Jacquard Standard Length Saree,3.5 out of 5 stars,649,£2.56,£17.09,(85% off)
7,SGF11,Women's Kanjivaram Woven Soft Silk Saree With Blouse Piece,4.0 out of 5 stars,"2,152",£15.18,£56.99,(73% off)
8,Sidhidata,Women's Kanjivaram Banarasi Soft Silk Saree With Unstitched Blouse Piece (Silk Box Flower),4.0 out of 5 stars,233,£6.17,£28.49,(78% off)
9,SIRIL,Women's Cotton Linen Printed Saree with Unstitched Blouse Piece,3.9 out of 5 stars,24,£8.06,£31.34,(74% off)
10,SAMAH,Women's Banarasi Silk Jacquard Saree with Unstitched Blouse Piece,4.2 out of 5 stars,247,£4.67,£17.28,(73% off)
11,SGF11,Women's Kanjivaram Soft Lichi Silk Saree With Blouse Piece,3.8 out of 5 stars,"1,396",£9.01,£56.99,(84% off)
12,SIRIL,Women's Banarasi Silk Saree Soft Kanjivaram Sari With Blouse Piece,3.2 out of 5 stars,121,£4.74,£24.08,(80% off)
13,Yashika,Women's Trendy Printed Georgette Red Color Saree with Blouse Material,3.7 out of 5 stars,521,£2.56,£17.09,(85% off)
14,AKHILAM,Women's Paper Silk Embroidered Saree With Unstitched Blouse Piece (AARYAN14301_KR_Parent),4.0 out of 5 stars,20,£15.67,£64.12,(76% off)
15,AKHILAM,Women's Shimmer Organza Sequence Embroidery Saree With Unstitched Blouse Piece,4.0 out of 5 stars,109,£11.87,£15.19,(22% off)
16,C J Enterprise,Women's Pure Soft Kanjivaram Silk Saree For Wedding Banarasi Style Sari With Blouse Piece (Vruksh-50),3.8 out of 5 stars,896,£4.74,£9.49,(50% off)
17,SGF11,Women's Kanjivaram Soft Cotton Linen Silk Saree With Blouse Piece,3.7 out of 5 stars,"1,042",£4.73,£56.99,(92% off)
18,SWORNOF,Womens Kanjivaram Banarasi Silk Saree Patola saree with Unstitched blouse piece,4.0 out of 5 stars,433,£9.49,£47.49,(80% off)
19,EthnicJunction,Women's Paithani Silk Blend Woven Saree With Blouse Piece,4.0 out of 5 stars,591,£4.14,£18.96,(78% off)
20,Sugathari,Women's Banarasi Saree Pure Kanjivaram Silk Saree Soft new ladies 2023 Design Wear Pattu Sarees Latest Cotton Party Sari collections With Blouse Piece for Wedding sadi (SAM PARI-113),4.1 out of 5 stars,245,£4.74,£21.84,(78% off)
21,Yashika,Women's Chanderi Floral Digital Print Chandheri Saree with Unstitched Blouse Material,4.8 out of 5 stars,84,£7.59,£17.09,(56% off)
22,Yashika,Women's Trendy Banarasi Kanjivaram Navy Color Art Silk Saree with Blouse Material,4.0 out of 5 stars,"1,126",£4.26,£17.09,(75% off)
23,Sugathari,Women's Banarasi Saree Pure Kanjivaram Silk Saree Soft new ladies 2023 Design Wear Pattu Sarees Latest Cotton Party Sari collections With Blouse Piece for Wedding sadi (PARI 164 WINE),4.1 out of 5 stars,398,£4.74,£23.74,(80% off)
24,SIRIL,Women's Pure Kanjivaram Silk Saree Soft Sarees Banarasi Style With Blouse Piece For Wedding,4.5 out of 5 stars,17,£4.73,£27.73,(83% off)
25,SIRIL,Women's Organza Sequence Embroidery Scollped Border Saree With Unstitched Blouse Piece,4.6 out of 5 stars,57,£15.85,£59.84,(74% off)
26,C J Enterprise,Womens Pure Banarasi Soft Silk Saree Kanjivaram Style Sarees With Blouse Piece For Wedding (KeriGola-51),3.9 out of 5 stars,561,£4.74,£9.49,(50% off)
27,MIRCHI FASHION,Women's Chiffon Floral Printed Saree with Blouse Piece,3.9 out of 5 stars,164,£4.55,£23.74,(81% off)
28,Yashika,Women's Banarasi Kanjivaram Cotton Silk Woven Saree with Unstitched Blouse Material (AZ-YS-OG-PADMA PURPLE),4.6 out of 5 stars,89,£4.62,£17.09,(73% off)
29,MIRCHI FASHION,Women's Chiffon Floral Printed Saree with Blouse Piece,4.0 out of 5 stars,477,£4.55,£3.45,(83% off)
30,Satrani,Women's Georgette Printed Satin Patta Saree with Unstitched Blouse Piece,4.1 out of 5 stars,211,£5.69,£21.37,(73% off)
31,SUPERLAXMI,"Self Design Kanjivaram Jacquard, Art Silk Saree",3.8 out of 5 stars,203,£4.27,£18.99,(78% off)
32,Yashika,Women's Fancy Banarasi Kanjivaram Art Silk Saree with Blouse Pieces||Yellow Coloured Kanjivaram Saree|| AZ-YS-OG-YUKTI YELLOW,3.9 out of 5 stars,637,£5.69,£5.70,(20% off)
33,C J Enterprise,Women's Soft Pure Kanjivaram Silk Saree For Wedding Banarasi Cotton Sari With Blouse Piece (Yatri-51),3.9 out of 5 stars,603,£4.74,£9.49,(50% off)
34,SGF11,Women's Kanjivaram Soft Cotton Linen Silk Saree With Blouse Piece,3.9 out of 5 stars,420,£9.01,£47.49,(81% off)
35,Yashika,Women's Elegant Chiffon Saree with Blouse Material - Embrace Trendy Style and Timeless Elegance in this Exquisite Attire,3.6 out of 5 stars,595,£3.77,£17.09,(78% off)
36,AKHILAM,Women's Satin Solid Saree With Unstitched Blouse,4.6 out of 5 stars,35,£13.29,£52.72,(75% off)
37,Yashika,Women's Trendy Printed Georgette Purple Color Saree with Blouse Material,3.4 out of 5 stars,624,£2.56,£17.09,(85% off)
38,SGF11,Women's Kanjivaram Soft Cotton Linen Silk Saree With Unstitched Blouse Piece,4.1 out of 5 stars,273,£12.34,£47.49,(74% off)
39,SIRIL,Women's Tassel & Printed Cotton Saree with Blouse,3.4 out of 5 stars,305,£4.55,£21.67,(79% off)
40,SWORNOF,Women's kanjivaram banarasi silk saree for festival Wedding silk with rich pallu Design sarees for women with Unstitched blouse piece,4.0 out of 5 stars,"1,702",£9.02,£33.25,(73% off)
41,AKHILAM,Women's Vichitra Silk Solid Saree With Unstitched Blouse (KESARI6001_KR11_Parent),4.2 out of 5 stars,14,£14.24,£55.85,(75% off)
42,AKHILAM,Women's Silk Blend Foil Printed Ready To Wear one Minute Saree With Unstitched Blouse Piece (RTWRIHANA1005_SR_Parent),4.0 out of 5 stars,17,£12.34,£48.92,(75% off)
43,EthnicJunction,Women's Silk Cotton Kalamkari Print Saree With Blouse Piece,4.1 out of 5 stars,"1,079",£3.46,£15.76,(78% off)
44,VJ Fashion,Women Kerala Silk Blend Saree With Blouse Piece_freesize,3.8 out of 5 stars,117,£3.51,£11.39,(69% off)
45,Yashika,Women's Fancy Banarasi Kanjivaram Art Silk Saree with Blouse Pieces|| AZ-YS-OG-ASHOKA-P,3.6 out of 5 stars,406,£4.26,£17.09,(75% off)
46,SIRIL,Women's Kanjivaram Silk Saree Jacquard Banarasi Sari With Blouse Piece For Wedding,4.3 out of 5 stars,55,£4.74,£24.69,(81% off)
47,MIRCHI FASHION,Women's Stylish Ethnic Chiffon Chintz Motif Border Pallu Printed Saree with Blouse Piece,3.9 out of 5 stars,961,£4.55,£3.37,(83% off)
48,Yashika,Women Cotton Saree,3.8 out of 5 stars,"1,299",£3.72,£17.09,(78% off)
49,AKHILAM,Women's Pure Crepe Striped Printed Saree With Unstitched Blouse Piece (NORAJRK101_HS_Parent),4.0 out of 5 stars,8,£12.34,£47.49,(74% off)
50,SIRIL,Women's Cotton Printed Saree With Unstitched Blouse Piece,4.0 out of 5 stars,28,£4.73,£20.89,(77% off)
51,SIRIL,Women's Cotton Silk Ikkat Printed Saree With Unstitched Blouse Piece,4.0 out of 5 stars,8,£9.48,£38.94,(76% off)
52,Yashika,Women Soft Zimmy Choo Fancy Silk Saree With Hand Work Lace Boarder & Comes With Unstitched Blouse Piece | Latest Sarees Bollywood Sari | New Sarees (AZ-YS-OG-DHAMAKA GOLD),5.0 out of 5 stars,189,£7.59,£17.09,(56% off)
53,SIRIL,Women's Kanjivaram Soft Silk Saree Pure Silk Saree With Unstitched Blouse Piece,4.5 out of 5 stars,2,£7.39,£28.49,(74% off)
54,Yashika,Women's Printed Trendy Art Silk Saree with Blouse Material||AZ-YS-P1-GULZAR-Parent,4.1 out of 5 stars,66,£2.56,£17.09,(85% off)
55,Yashika,"Women's Woven Elegant Printed Art Silk Saree with Matching Blouse Material-Perfect for Festive Special Occasions, Exquisite Design and Vibrant Colors",3.7 out of 5 stars,239,£2.56,£17.09,(85% off)
56,Shiv Textiles,Women's Banarasi Silk Saree,3.9 out of 5 stars,652,£3.79,£9.49,(60% off)
57,SIRIL,Women's Georgette Foil Printed Saree with Unstitched Blouse Piece,4.3 out of 5 stars,5,£7.59,£31.34,(76% off)
58,SGF11,Women's Kanjivaram Pure Handloom Soft Silk Saree With Blouse Piece,4.1 out of 5 stars,47,£15.18,£85.49,(82% off)
59,Yashika,Women's Hot Fix Solid Color Satin Moss Saree with Unstitched Blouse Material,4.2 out of 5 stars,268,£8.83,£17.09,(48% off)
60,SIRIL,Women's Cotton Jacquard Saree With Unstitched Blouse Piece,4.2 out of 5 stars,159,£14.24,£62.08,(77% off)
61,Sugathari,Women's Banarasi Saree Pure Kanjivaram Silk Saree Soft new ladies 2025 Design Wear Pattu Sarees Latest Sadi Party Sari collections With Blouse Piece (San Pari-224),4.4 out of 5 stars,43,£4.74,£23.74,(80% off)
62,SGF11,Women's Kanjivaram Designer Soft Silk Sarees With Blouse Piece,3.8 out of 5 stars,43,£12.34,£85.49,(86% off)
63,SGF11,Women's Kanjivaram Pure Soft Silk Designer Saree With Blouse Piece,4.3 out of 5 stars,40,£12.34,£85.49,(86% off)
64,C J Enterprise,Women's Pure Kanjivaram Silk Saree Soft Banarasi Style Wedding With Blouse Piece (Vruksh-51),3.8 out of 5 stars,608,£5.22,£9.49,(45% off)
65,VJ Fashion,Women Woven Soft Silk Saree With Blouse Piece_freesize,3.8 out of 5 stars,229,£4.74,£15.19,(69% off)
66,Yashika,Women's Art Silk Saree,3.6 out of 5 stars,"2,162",£2.33,£17.09,(86% off)
67,MIRCHI FASHION,Women's Latest Chiffon Batik Printed Saree with Blouse Piece,3.9 out of 5 stars,"1,841",£4.46,£4.05,(83% off)
68,Monjolika Fashion,Women's Banarasi Silk Blend Woven Zari With Tussles Saree and Jacquard Woven Blouse Piece (37765 color),4.0 out of 5 stars,"2,376",£14.24,£66.49,(79% off)
69,SIRIL,Women's Floral Printed Georgette Saree with Unstitched Blouse Piece,3.7 out of 5 stars,540,£2.84,£13.12,(78% off)
70,AKHILAM,Women's Satin Solid Ready To Wear one Minute Saree With Unstitched Blouse Piece (RTWRADHA1001_RX_Parent),4.1 out of 5 stars,73,£14.24,£57.47,(75% off)
71,Yashika,Women Art Silk Standard Length Saree,3.7 out of 5 stars,"7,835",£2.56,£17.09,(85% off)
72,HAIDER ALI AND SONS,Pure Linen Ethnic Wear Saree For Women's (With Blouse)_,4.1 out of 5 stars,51,£6.68,£21.38,(69% off)
73,Yashika,Women's Magludi Silk Saree Printed Saree With Unstitched Blouse Material - Suitable For All Indian Occasions and Festivals,4.0 out of 5 stars,196,£4.27,£17.09,(75% off)
74,C J Enterprise,Women's Pure Soft Kanjivaram Cotton Silk Saree Banarasi Style With Blouse Piece for Wedding (Cotton-Lavender),3.9 out of 5 stars,124,£5.69,£9.49,(40% off)
75,SIRIL,Women's Satin Silk Hot Fixing Stone Work Saree with Unstitched Blouse,4.1 out of 5 stars,467,£7.58,£32.85,(77% off)
76,Yashika,Georgette Womens Saree,3.9 out of 5 stars,336,£3.77,£17.09,(78% off)
77,Yashika,Women Cotton Saree,3.8 out of 5 stars,"1,543",£3.41,£23.74,(86% off)
78,Sidhidata,Women's Georgette Digital Printed Ready To Wear one Minute Saree With Unstitched Blouse Piece,3.7 out of 5 stars,"1,811",£9.48,£28.49,(67% off)
79,C J Enterprise,Women's Banarasi Saree Pure Kanjivaram Style Silk Saree With Blouse Piece for Wedding (Shiv-1),4.1 out of 5 stars,23,£5.22,£9.49,(45% off)
80,Yashika,Women's Woven Latest Georgette Saree with Lace and Blouse Material,4.5 out of 5 stars,187,£3.75,£17.09,(78% off)
81,Ekasya,Women Georgette Pink Geometric Pattern Printed Embroidery Saree with Unstitched Blouse (E6253_1) - Elegant and Intricate Embroidery,3.4 out of 5 stars,25,£15.19,£37.99,(60% off)
82,AKHILAM,Women's Georgette Embellished Saree With Unstitched Blouse,3.4 out of 5 stars,21,£17.09,£68.87,(75% off)
83,Satrani,Women's Silk Blend Banarasi Jacquard Saree with Unstitched Blouse Piece,4.2 out of 5 stars,35,£5.69,£21.37,(73% off)
84,Yashika,Women's Trendy Georgette Orange Color Saree with Blouse Material,3.6 out of 5 stars,218,£2.56,£17.09,(85% off)
85,Yashika,Women Silk Saree,3.4 out of 5 stars,847,£2.56,£17.09,(85% off)
86,SWORNOF,Womens Kanjivaram Banarasi Silk Saree Patola saree with Unstitched blouse piece,4.2 out of 5 stars,720,£9.49,£47.49,(80% off)
87,Yashika,Women's Floral Printed White Dola Silk Jacquard Saree With Unstitched Blouse Material For Women (AZ-YS-OG-GYANI),4.8 out of 5 stars,64,£6.64,£17.09,(61% off)
88,Yashika,Women's Woven Printed Art Silk Saree with Unstitched Blouse Material,3.4 out of 5 stars,108,£2.65,£17.09,(84% off)
89,Yashika,Women Georgette Standard Length Saree,3.3 out of 5 stars,"1,177",£2.56,£17.09,(85% off)
90,TRENDMALLS,Women's Rangoli Silk Embroidery Saree with Unstitch Blouse Piece Saree for Women,4.1 out of 5 stars,385,£15.17,£37.04,(59% off)
91,ZECVA,Women's Pure Spun Linen Cotton Lichi Silk Saree With Attach Unstitch Blouse Piece,3.9 out of 5 stars,103,£7.53,£56.99,(87% off)
92,AKHILAM,Women's Organza Ethnic Motif Woven Design Saree With Unstitched Blouse Piece(UNATI3001_AC_Parent),4.0 out of 5 stars,103,£9.49,£39.70,(76% off)
93,Sugathari,Women's Banarasi Saree Pure Kanjivaram Silk Saree Soft new ladies 2023 Design Wear Pattu Sarees Latest Party Sari collections With Blouse Piece for Wedding sadi (SAN PARI-182 DARK GREEN),4.0 out of 5 stars,353,£4.74,£21.84,(78% off)
94,SIRIL,Women's Floral Printed Georgette Saree with Unstitched Blouse Piece,3.4 out of 5 stars,861,£2.79,£15.33,(82% off)
95,SGF11,Women's Kanjivaram Pure Soft Silk Designer Saree With Blouse Piece,4.0 out of 5 stars,44,£14.23,£85.49,(83% off)
96,SIRIL,Women's Cotton Printed Saree With Unstitched Blouse Piece,4.2 out of 5 stars,31,£4.55,£20.89,(78% off)
97,Yashika,Women Saree,3.4 out of 5 stars,"5,395",£2.56,£17.09,(85% off)
98,SIRIL,Women's Shimmer Chiffon Sequence Embroidery Scalloped Border Saree With Unstitched Blouse Piece,3.6 out of 5 stars,5,£15.18,£56.99,(73% off)
99,Satrani,Women's Georgette Floral Printed Satin Stripe Saree with Unstitched Blouse Piece,4.3 out of 5 stars,56,£5.69,£21.37,(73% off)
100,Avantika Fashion,Women's Kanjivaram Soft Pure Silk Banarasi Sarees With Blouse Piece,3.8 out of 5 stars,359,£4.27,£23.74,(82% off)
101,Satrani,Women's Satin Digital Print Saree with Unstitched Blouse Piece,3.9 out of 5 stars,115,£9.49,£38.94,(76% off)
102,AKHILAM,Women's Tissue Lace Work Saree with Unstitched Blouse Piece,3.6 out of 5 stars,39,£15.67,£74.09,(79% off)
103,Yashika,Women's Zari Woven Cotton Silk Jacquard Saree With Unstitched Blouse Material,4.0 out of 5 stars,301,£4.70,£17.09,(72% off)
104,C J Enterprise,Women's Pure Soft Kanjivaram Silk Saree Banarasi Design Style With Blouse Piece for Wedding (Pari9016-51),4.1 out of 5 stars,766,£4.90,£9.49,(48% off)
105,C J Enterprise,Women’s Pure Soft Cotton Saree Linen For Kalamkari Silk Sarees Latest Party Design Wear Wedding Sadi With Blouse Piece Sari South Mulmul ikkat Mul Print 2025 New (Kalamkari) (Grey),3.7 out of 5 stars,93,£7.59,£9.49,(20% off)
106,SIRIL,Women's Printed Silk Crepe Saree with Unstitched Blouse Piece,4.3 out of 5 stars,83,£8.07,£33.43,(76% off)
107,Jaanvi fashion,Women's Banarasi Silk Sarees With Zari Jacquard Work & Blouse Piece,3.9 out of 5 stars,815,£6.18,£28.50,(78% off)
108,SIRIL,Women's Banarasi Soft Silk Saree Pure Silk with Unstitched Blouse Piece,3.8 out of 5 stars,62,£4.73,£23.74,(80% off)
109,C J Enterprise,Women's Banarasi Saree Pure Kanjivaram Style Silk Saree With Blouse Piece for Wedding (KeriButti-51),3.9 out of 5 stars,92,£4.74,£9.49,(50% off)
110,Yashika,Women's Trendy Cotton Silk Saree with Blouse Material|| Pongal Special South Indian kerala Saree With Blouse Piece||(AZ-YS-OG-PONGAL ONAM WHITE),3.8 out of 5 stars,304,£3.39,£17.09,(80% off)
111,Yashika,Womens Jacquard Standard Length Saree,3.5 out of 5 stars,891,£2.56,£17.09,(85% off)
112,SIRIL,Women's Georgette Bandhani Printed Sequence Embroidery Lace Saree With Unstitched Blouse Piece,3.6 out of 5 stars,46,£9.48,£37.04,(74% off)
113,Sugathari,Women's Banarasi Saree Pure Kanjivaram Silk Saree Soft new ladies 2023 Design Wear Pattu Sarees Latest Cotton Party Sari collections With Blouse Piece for Wedding sadi (PARI 122 MAROON),4.0 out of 5 stars,420,£4.74,£23.74,(80% off)
114,C J Enterprise,Women's Pure Kanjivaram Silk Saree Paithani Soft Wedding Sarees With Blouse Piece (Chand paithani),4.3 out of 5 stars,48,£5.69,£9.49,(40% off)
115,Yashika,Women's Printed Trendy Georgette Green Color Saree With Blouse Material,3.6 out of 5 stars,139,£2.56,£17.09,(85% off)
116,Yashika,Georgette Womens Saree,3.6 out of 5 stars,391,£2.56,£17.09,(85% off)
117,AKHILAM,Women's Georgette Sequins Work Saree With Unstitched Blouse Piece (SALSA8001_TFH_Parent),3.8 out of 5 stars,14,£19.94,£85.02,(77% off)
118,MIRCHI FASHION,Women's Plain Weave Chiffon Abstrect Printed Saree with Blouse Piece,3.8 out of 5 stars,396,£4.46,£2.53,(83% off)
119,MIRCHI FASHION,Women's Chiffon Floral Printed Saree with Blouse Piece,4.0 out of 5 stars,147,£4.55,£2.72,(83% off)
120,MIRCHI FASHION,Women's Plain Weave Chiffon Ethnic Motif Printed Saree with Blouse Piece,4.0 out of 5 stars,442,£4.44,£26.59,(83% off)
121,Yashika,"Women's Woven Saree with Matching Unstitched Blouse and Soft Art Silk Fabric Ultimate Comfort-Suitable for Parties, Festivals, Weddings",3.5 out of 5 stars,84,£2.56,£17.09,(85% off)
122,arriva fab,women's kutchi work embroidered Exclusive wear sare,4.0 out of 5 stars,"3,534",£8.35,£28.49,(71% off)
123,Yashika,Women's Printed Georgette Printed Saree With Lace Border and Blouse Material,4.5 out of 5 stars,92,£3.79,£17.09,(78% off)
124,Avantika Fashion,Women's Kanjivaram Soft Semi Silk Banarasi Sarees With Blouse Piece,3.9 out of 5 stars,73,£4.74,£35.14,(87% off)
125,SIRIL,Women's Banarasi Soft Silk Saree Pure Silk With Unstitched Blouse Piece,3.6 out of 5 stars,40,£7.40,£27.73,(73% off)
126,Satrani,Women's Chanderi Cotton Printed Ready To Wear One Minute Pre Pleated Readymade Saree with Unstitched Blouse Piece,4.3 out of 5 stars,51,£9.02,£25.74,(65% off)
127,Avantika Fashion,Women's Kanjivaram Soft Silk Banarasi Sarees With Blouse Piece,4.0 out of 5 stars,96,£8.01,£23.74,(66% off)
128,SIRIL,Women's Georgette Printed Saree With Blouse Piece,3.6 out of 5 stars,598,£3.32,£13.85,(76% off)
129,AKHILAM,Women's Georgette Embellished Saree With Unstitched Blouse Piece,4.1 out of 5 stars,74,£27.54,£117.32,(77% off)
130,Satrani,Women'S Chiffon Ready To Wear Saree With Unstitched Blouse Piece,3.6 out of 5 stars,575,£7.02,£26.40,(73% off)
131,Yashika,Women's Banarasi Kanjivaram Cotton Silk Jaquard Saree Printed Saree With Unstitched Blouse Material - Suitable For All Indian Occasions and Festivals,3.9 out of 5 stars,214,£4.62,£17.09,(73% off)
132,Sugathari,Women's Banarasi Saree Pure Kanjivaram Silk Saree Soft new ladies 2025 Design Wear Pattu Sarees Latest Sadi Party Sari collections With Blouse Piece (San Pari-225),4.1 out of 5 stars,38,£4.74,£23.74,(80% off)
133,Sugathari,Women's Pure Kanjivaram Silk Saree Banarasi Silk Saree With Blouse Piece (SAM PARI S-7),4.0 out of 5 stars,154,£4.74,£21.84,(78% off)
134,Yashika,Women's New Bollywood Soft Tissue Silk Saree With Blouse Material |saree for Women | New Sari | Latest Saree,4.6 out of 5 stars,34,£5.69,£17.09,(67% off)
135,Jaanvi fashion,Women's Paithani Silk Saree With Zari Work & Blouse Piece,4.1 out of 5 stars,289,£10.44,£28.50,(63% off)
136,Yashika,Women's Woven Printed Art Silk Saree with Unstitched Blouse Material,3.8 out of 5 stars,38,£2.56,£17.09,(85% off)
137,Yashika,Women's Crepe Saree,3.6 out of 5 stars,"2,466",£2.56,£11.09,(77% off)
138,SIRIL,Women's Georgette Printed Saree With Unstitched Blouse Piece Combo Pack Of 2,3.5 out of 5 stars,54,£4.73,£23.71,(80% off)
139,TRENDMALLS,Women's Georgette Sequin Embroidery work Saree with Unstitch Blouse Piece (K963-Skyblue),3.8 out of 5 stars,144,£20.61,"£2,060.55",(69% off)
140,Yashika,Women's Jacquard Banarasi Kanjivaram Saree,3.9 out of 5 stars,388,£4.62,£17.09,(73% off)
141,EthnicJunction,Women's Art Silk Warli Print Saree With Blouse Piece,4.1 out of 5 stars,47,£3.32,£16.30,(80% off)
142,Yashika,Georgette Womens Saree,3.8 out of 5 stars,195,£3.72,£17.09,(78% off)
143,SIRIL,Women's Georgette Floral Printed Saree With Unstitched Blouse Piece,3.8 out of 5 stars,445,£3.60,£13.48,(73% off)
144,MIRCHI FASHION,Women's Chiffon Floral Printed Saree with Blouse Piece,4.1 out of 5 stars,56,£3.78,£3.40,(86% off)
145,MIRCHI FASHION,Women's Chiffon Block Printed Saree with Blouse Piece,4.1 out of 5 stars,39,£3.79,£3.43,(86% off)
146,SWORNOF,Womens Linen Silk Saree | Saree for Women With Unstitched Blouse | Saree with Blouse Piece | Soft and Skin Friendly,4.4 out of 5 stars,20,£8.07,£24.69,(67% off)
147,SGF11,Women's Kanjivaram Pure Soft Silk Handloom Saree Pure Golden Zari With Blouse Piece,4.1 out of 5 stars,870,£14.23,£85.49,(83% off)
148,AKHILAM,Women's Paper Silk Embroidered Saree With Unstitched Blouse (KESARI11901_KR_Parent),3.9 out of 5 stars,10,£15.67,£65.54,(76% off)
149,C J Enterprise,Women's Pure Soft Kanjivaram Cotton Silk Saree Banarasi Style With Blouse Piece for Wedding (Fatima-51),3.8 out of 5 stars,335,£5.69,£9.49,(40% off)
150,Yashika,Women's Solid Red Banarasi Kanjivaram Cotton Silk Saree With Unstitched Blouse Material For Women (AZ-YS-OG-JHATKA RED),4.7 out of 5 stars,25,£4.74,£17.09,(72% off)
151,C J Enterprise,Women's Pure Kanjivaram Soft Silk Saree Banarasi Style Sarees For Wedding With Blouse Piece (Almari-51),3.9 out of 5 stars,246,£8.54,£9.49,(10% off)
152,SIRIL,Women's Georgette Leheriya Printed Ready To Wear One Minute Pleated Saree With Unstitched Blouse Piece,3.2 out of 5 stars,62,£7.40,£28.46,(74% off)
153,EthnicJunction,Women's Silk Blend Woven Paithani saree With Blouse Piece,4.2 out of 5 stars,142,£4.95,£21.62,(77% off)
154,dB DESH BIDESH,Women`s Bengali Khesh Mul Pure Cotton Handloom Saree With Blouse Piece,3.9 out of 5 stars,248,£7.68,£39.89,(81% off)
155,Yashika,Women's Art Silk Saree,3.6 out of 5 stars,"1,327",£2.56,£17.09,(85% off)
156,SIRIL,Women's Kanjivaram Silk Saree Pure Silk Banarasi Saree With Unstitched Blouse Piece,4.1 out of 5 stars,31,£15.56,£59.84,(74% off)
157,Yashika,Women's Banarasi Kanjivaram Cotton Silk Woven Saree with Unstitched Blouse Material,4.4 out of 5 stars,81,£4.27,£17.09,(75% off)
158,RANI SAAHIBA,Women's Chiffon Bandhani Printed Saree Without Blouse,4.0 out of 5 stars,153,£5.60,£18.99,(71% off)
159,Yashika,Women's Art Silk Saree Plain Standard Length,3.6 out of 5 stars,606,£2.56,£17.09,(85% off)
160,SAREE MALL,Women's Cotton Bandhani Printed Ready To Wear one Minute Saree With Unstitched Blouse,3.5 out of 5 stars,99,£9.49,£35.62,(73% off)
161,Yashika,Women's Floral Printed Jacquard Georgette Saree With Unstitched Blouse Mateial,3.7 out of 5 stars,787,£2.56,£17.09,(85% off)
162,C J Enterprise,Women's Pure Kanjivaram Silk Saree Banarasi Soft Sari With Blouse Piece For Wedding (Pari124-50),3.9 out of 5 stars,645,£5.22,£9.49,(45% off)
163,SIRIL,Women's Kanjivaram Silk Saree Pure Silk Banarasi Saree With Unstitched Blouse Piece,3.8 out of 5 stars,32,£15.00,£56.99,(74% off)
164,SIRIL,Women's Georgette Bandhani Printed Saree with Blouse,3.6 out of 5 stars,624,£2.80,£12.45,(77% off)
165,SIRIL,Women's Pure Cotton Batik Printed Ready To Wear Saree With Unstitched Blouse Piece,2.1 out of 5 stars,3,£9.11,£37.99,(76% off)
166,Satrani,Women's Organza Sequins Embroidery Jacquard Saree with Unstitched Blouse Piece,4.1 out of 5 stars,20,£7.78,£24.41,(68% off)
167,TRENDMALLS,"Women's Vichitra Silk Embroidery, Siroski Stone Work Saree with Unstitch Blouse Piece",4.3 out of 5 stars,45,£36.76,£132.99,(72% off)
168,Sugathari,Women's Banarasi Saree Pure Kanjivaram Silk Saree Soft new ladies 2023 Design Wear Pattu Sarees Latest Cotton Party Sari collections With Blouse Piece for Wedding sadi (SAM PARI-100),4.1 out of 5 stars,178,£4.74,£23.74,(80% off)
169,RANI SAAHIBA,Women's Chiffon Lehriya Printed Saree Without Blouse (SKR11126_Multi),3.9 out of 5 stars,118,£5.60,£18.99,(71% off)
170,TRENDMALLS,Women's Vichitra Silk Embroidery Work Saree with Unstitch Blouse Piece,4.2 out of 5 stars,21,£16.24,£41.79,(61% off)
171,Yashika,Women's Mysore Silk Art Saree,3.4 out of 5 stars,455,£2.65,£13.08,(80% off)
172,Yashika,Women's Solid White Color and Gold Border Cotton Blend Saree with Unstitched Blouse Material-Special for Pongal Onam Festival (AZ-YS-OG1-PONGAL,3.7 out of 5 stars,63,£3.41,£17.09,(80% off)
173,Yashika,Women's Georgette Printed Saree with Blouse Piece (Power Blue) Blue03,3.7 out of 5 stars,56,£2.56,£17.09,(85% off)
174,SIRIL,Women's Pure Cotton Printed Saree With Unstitched Blouse Piece,3.6 out of 5 stars,23,£6.82,£29.19,(77% off)
175,AKHILAM,Women's Silk Blend Woven Design Celebrity Saree With Blouse Piece,3.6 out of 5 stars,189,£13.77,£52.24,(74% off)
176,SIRIL,Women's Printed Pure Cotton Saree with Unstitched Blouse Piece,3.8 out of 5 stars,63,£6.36,£27.37,(77% off)
177,Yashika,Women's Woven Cotton Silk Saree,3.7 out of 5 stars,57,£4.27,£17.09,(75% off)
178,Sugathari,Women's Banarasi Saree Pure Kanjivaram Silk Saree Soft new ladies 2025 Design Wear Pattu Sarees Latest Sadi Party Sari collections With Blouse Piece (San Pari-222),4.6 out of 5 stars,42,£4.74,£23.74,(80% off)
179,Yashika,Women's Art Silk Sarees,3.7 out of 5 stars,460,£2.56,£17.09,(85% off)
180,Yashika,Women's Plain Digital Print Art Silk Cotton Saree with Tassels Golden Border-Lightweight Elegant Ethnic Wear for Festive and Casual Occasions,4.7 out of 5 stars,44,£4.70,£17.09,(72% off)
