,Brand Name,Product Name,Rating,Rating Count,Selling Price,MRP,Offer
50,Peter England,Men's Classic Solid Full Sleeve Slim Fit Shirt | Wonder Fabric | Cotton Rich | Pin Point Oxford,4.0 out of 5 stars,129,£7.31,£13.29,(45% off)
51,Van Heusen,Men's Cotton Slim Fit Durapress Superior Textured Shirt,4.2 out of 5 stars,5,£13.86,£24.69,(44% off)
52,Arrow,Men's Solid Full Sleeve Slim Fit Cutaway Collar Cotton Formal Shirt,4.0 out of 5 stars,245,£9.40,£20.89,(55% off)
53,Peter England,Men's Regular Fit Full Sleeve Striped Formal Shirt | Cotton Rich | Wonder Fabric | Premium Dobby Weave,3.9 out of 5 stars,42,£9.18,£17.09,(46% off)
54,Peter England,Men's Slim Fit Full Sleeve Checkered Casual Shirt | 100% Cotton | Premium Twill Weave,4.0 out of 5 stars,356,£9.40,£17.09,(45% off)
55,Peter England,Men's Solid Regular Fit Shirt,4.0 out of 5 stars,124,£8.83,£11.39,(23% off)
56,The Indian Garage Co,Men's Cotton Regular Fit Solid Full Sleeves Spread Collar Casual Shirt,3.7 out of 5 stars,428,£4.82,£16.62,(71% off)
57,GRECIILOOKS,Shirt for Men | Man Stylish | Printed | Men's Regular Fit Mens Casual | Formal | Man's Solid Slim Fit | Half Sleeve | Summer Outdoor Activities | Textured (Available in Plus Size and Combo Pack of 2),4.2 out of 5 stars,572,£4.46,£18.99,(77% off)
58,Louis Philippe,Men's Premium Cotton Easy to Care Slim fit Checks Casual Shirt with Natural Stretch,3.8 out of 5 stars,38,£13.58,£23.74,(43% off)
59,Park Avenue,Men's Pure Cotton Checks Pattern Slim Fit Semi Cutaway Collar Full Sleeve Formal Shirt,4.2 out of 5 stars,94,£10.44,£20.89,(50% off)
60,Highlander,Men's Slim Fit Shirts | Solid | Long Sleeves | Spread Collar | Formal Shirts | Stylish Shirt,3.0 out of 5 stars,2,£4.27,£13.29,(68% off)
61,Van Heusen,Men's Solid Slim Fit Formal Shirt,3.9 out of 5 stars,765,£9.49,£18.99,(50% off)
62,Louis Philippe,Men's Easy to Iron Premium Cotton Wrinkle Resistant Slim fit Textured Formal Shirt,4.7 out of 5 stars,7,£13.58,£23.74,(43% off)
63,Peter England,Men's Classic Textured Slim Fit Full Sleeve Shirt | Wonder Fabric | Cotton Rich | Premium Dobby,4.0 out of 5 stars,266,£7.69,£15.19,(49% off)
64,Louis Philippe,Men's Easy to Care Cotton Slim fit Solid Casual Shirt with Natural Stretch,3.9 out of 5 stars,148,£13.10,£21.84,(40% off)
65,Peter England,Men's Slim Fit Full Sleeve Striped Formal Shirt | Cotton Rich | Wonder Fabric | Pin Point Oxford,4.2 out of 5 stars,128,£7.50,£13.29,(44% off)
66,Van Heusen,Men's Cotton Solid Slim Fit Shirt,4.0 out of 5 stars,117,£10.92,£21.84,(50% off)
67,BE ACTIVE,Men's Solid Slim Fit Cotton Formal Shirts || Men Stylish Shirt || Spread Collar & Full Sleeves || Timeless Style & Comfort,3.6 out of 5 stars,733,£3.89,£10.44,(63% off)
68,Van Heusen,Formal Printed Shirt for Men| Premium Cotton| Full Sleeves| Slim Fit |Breathable Fabric,4.2 out of 5 stars,300,£9.49,£18.99,(50% off)
69,Majestic Man,Men Small Checkered Slim Fit Cotton Casual Shirt,4.0 out of 5 stars,653,£5.50,£14.24,(61% off)
70,Majestic Man,Slim Fit Cotton Casual Check Shirt for Men,3.9 out of 5 stars,"2,832",£4.74,£14.24,(67% off)
71,Louis Philippe,Men's Over Dyed Solid Premium Slim fit Casual Shirt with Washed Look & Soft Hand Feel,3.9 out of 5 stars,251,£10.82,£18.99,(43% off)
72,Van Heusen,Formal Printed Shirt for Men| Premium Cotton| Full Sleeves| Slim Fit |Breathable Fabric,3.8 out of 5 stars,593,£9.49,£18.04,(47% off)
73,Van Heusen,Men's 100% Cotton Slim Fit Checkered Solid Shirt,4.0 out of 5 stars,840,£9.49,£18.99,(50% off)
74,Peter England,Men's Classic Slim Fit Full Sleeve Oxford Shirt | 100% Cotton,4.0 out of 5 stars,487,£9.02,£16.14,(44% off)
75,Pinkmint,Cotton Spread Collar Long Sleeve Shirt for Men Formal Wear Office Wear Multicolour,3.7 out of 5 stars,362,£3.79,£18.99,(80% off)
76,XJARVIS,Clifton Men's Cotton Blend Shirt | Formal Shirt with Pocket | Plain | Spread Collar & Full Sleeves | Summer - Regular Fit,3.8 out of 5 stars,477,£7.97,£3.99,(68% off)
77,Peter England,Men's Cotton Slim Fit Solid Full Sleeve Casual Shirt,3.6 out of 5 stars,752,£7.69,£15.19,(49% off)
78,MILDIN,Men's Regular Cotton Blend Slim Fit Solid Button Down Spread Collar Half Sleeve Curved Hemline Formal Shirt with One Pocket,4.0 out of 5 stars,38,£2.84,£9.49,(70% off)
79,Majestic Man,Men's Cotton Slim Fit Solid Casual Shirt,3.8 out of 5 stars,"1,878",£4.74,£14.24,(67% off)
80,Pinkmint,Men's Combo Shirt Cotton Stylish Spread Collar Long Sleeve Shirt Formal Wear (Pack of 3),3.5 out of 5 stars,134,£7.12,£2.37,(63% off)
81,NexaFlair,Men's Solid Linen Cotton Shirt | Casual | Plain | Full Sleeve | Summer-Regular Fit| Men Stylish Shirt | Everyday Formal Wear,2.6 out of 5 stars,154,£4.73,£18.99,(75% off)
82,Thomas Scott,Men's Cotton Regular Fit Shirt,3.8 out of 5 stars,106,£5.69,£25.64,(78% off)
83,Van Heusen,Men's Cotton Slim Fit Solid Formal Shirt,3.6 out of 5 stars,282,£9.50,£18.99,(50% off)
84,IndoPrimo,Men's Solid Regular Fit Shirt,3.7 out of 5 stars,651,£4.27,£18.99,(78% off)
85,IndoPrimo,Men's Stylish Solid Satin Casual Shirt for Men Full Sleeve,4.1 out of 5 stars,571,£4.74,£9.49,(50% off)
86,Majestic Man,Men Comfort Slim Fit Opaque Checked Cotton Casual Shirt,4.1 out of 5 stars,105,£4.27,£14.24,(70% off)
87,Majestic Man,Men Comfort Slim Fit Opaque Checked Pure Cotton Casual Shirt,4.0 out of 5 stars,208,£5.12,£14.24,(64% off)
88,GUSTAVE,Men's Shirt Stays Adjustable Elastic Shirt Tucker Belt with Locking Non-Slip Clips,4.0 out of 5 stars,968,£3.75,£6.12,(39% off)
89,Amazon Brand - Symbol,Men Slim Fit Formal Shirt,3.7 out of 5 stars,"5,009",£5.69,£16.14,(65% off)
90,FYLTR,Men's Regular Fit Solid Shirt - Full Sleeve| Functional Pocket | Contrast Trim Fabric | Formal Shirts for Men,4.3 out of 5 stars,95,£4.74,£13.29,(64% off)
91,FINIVO FASHION,Men's Casual Cotton Plain Button Down Shirt Long Sleeve Textured Summer Beach Shirt for Men,4.1 out of 5 stars,764,£4.74,£14.24,(67% off)
92,Dennis Lingo,Men Cotton Solid Spread Collar Full Sleeves Regular Fit Casual Shirt,3.8 out of 5 stars,"40,873",£5.69,£17.57,(68% off)
93,Van Heusen,Men's Cotton Linen Floral Printed Full Sleeve Regular Fit Shirt,3.5 out of 5 stars,2,£16.52,£29.44,(44% off)
94,BE ACTIVE,Men's Premium Cotton Lining Shirt | Full Sleeves with Collared Down Buttons,3.8 out of 5 stars,42,£5.79,£14.24,(59% off)
95,Allen Solly,Men's Cotton Regular Fit Shirt (Assfqspff95028_Pink 40),3.8 out of 5 stars,36,£9.68,£17.09,(43% off)
96,Peter England,Men's Solid Slim Fit Shirt,4.1 out of 5 stars,146,£9.50,£15.19,(37% off)
97,Highlander,Men's Striped Slim Fit Shirt,4.5 out of 5 stars,31,£5.22,£17.09,(69% off)
98,Amazon Brand - Symbol,Men's Solid Cotton Blend Half Sleeve Regular Fit Formal Shirt,3.7 out of 5 stars,272,£5.03,£15.19,(67% off)
99,IndoPrimo,Men's Satin Plain Shirt with Spread Collared Neck Full Sleeves Curved Hem Length | Shirt for Man,4.1 out of 5 stars,293,£4.74,£9.49,(50% off)
100,TAGDO,Men's Regular Fit Casual Shirt (5171),4.0 out of 5 stars,"1,054",£3.70,£15.19,(76% off)
101,TAGDO,Men's Regular Fit Casual Shirt (5171),4.0 out of 5 stars,"1,054",£3.70,£15.19,(76% off)
102,Allen Solly,Men's 100% Cotton Slim Fit Shirt,3.9 out of 5 stars,"7,882",£8.35,£13.29,(37% off)
103,Van Heusen,Men's Cotton Solid Slim Fit Shirt,4.0 out of 5 stars,1,£10.39,£20.89,(50% off)
104,Majestic Man,Men's Comfort Slim Fit Pure Cotton Opaque Checked Casual Shirt,4.0 out of 5 stars,78,£4.74,£14.24,(67% off)
105,Amazon Brand - Symbol,Men's Cotton Shirt | Casual | Plain | Full Sleeve | Summer - Regular Fit (Available in Plus Size and Combo Packs),3.8 out of 5 stars,"7,372",£6.17,£13.29,(54% off)
106,The Indian Garage Co,Men's Cotton Slim Fit Checkered Full Sleeves Cutaway Collar Casual Shirt,4.1 out of 5 stars,400,£5.65,£16.62,(66% off)
107,Allen Solly,Men's 100% Cotton Slim Fit Full Sleeve Striped Shirt,3.8 out of 5 stars,135,£9.68,£18.04,(46% off)
108,Peter England,Men Cotton Blend Regular Fit T-Shirt,4.0 out of 5 stars,1,£9.49,£18.99,(50% off)
109,Pinkmint,Men's Solid Classic Fit Shirt,3.5 out of 5 stars,467,£5.69,£18.99,(70% off)
110,Majestic Man,Men Box Checkered Slim Fit Cotton Casual Shirt,4.0 out of 5 stars,449,£5.31,£14.24,(63% off)
111,MILDIN,Men's Regular Cotton Blend Slim Fit Solid Button Down Spread Collar Full Sleeve Curved Hemline Formal Shirt with One Pocket,4.2 out of 5 stars,40,£3.51,£9.49,(63% off)
112,Peter England,Men's Everyday Ditsy Print Slim Fit Full Sleeve Casual Shirt | 100% Cotton,4.1 out of 5 stars,387,£8.54,£15.19,(44% off)
113,Peter England,Men's Cotton Regular Fit Shirt,3.7 out of 5 stars,10,£11.39,£17.09,(20% off)
114,Majestic Man,Pure Cotton Smart Slim Fit Opaque Solid Casual Shirt,4.0 out of 5 stars,33,£4.08,£14.24,(71% off)
115,Allen Solly,Men's Cotton Regular Fit Polo T-Shirt,4.1 out of 5 stars,"5,526",£6.76,£10.92,(38% off)
116,Van Heusen,Men's Cotton Slim Fit Printed Formal Shirt,3.9 out of 5 stars,170,£12.44,£21.84,(43% off)
117,Louis Philippe,Men's Cotton Solid Slim Fit Shirt,4.0 out of 5 stars,1,£12.34,£24.69,(50% off)
118,Peter England,Men's Striped Regular Fit Shirt,3.8 out of 5 stars,32,£7.60,£15.19,(50% off)
119,Majestic Man,Men Comfort Slim Fit Checked Pure Cotton Half Sleeve Casual Shirt,3.9 out of 5 stars,205,£4.74,£14.24,(67% off)
120,Amazon Brand - Symbol,Men's Solid Cotton Rich Formal Shirt | Plain | Full Sleeve-Regular Fit (Available in Plus Size),3.9 out of 5 stars,"1,613",£2.94,£16.14,(82% off)
121,Miraan,Men's Casual Cotton Short Kurta Tailored Fit Shirt With Mandarin Collar (Sigshortkurta),3.9 out of 5 stars,549,£5.64,£24.39,(77% off)
122,GRECIILOOKS,Men's Formal Button Down Shirt – Slim Fit Office Wear Shirt's for Men | Textured Long Sleeve Cotton Blend | Business & Meeting Ready (Available in Plus Size and Combo Pack of 2),4.0 out of 5 stars,"2,406",£4.74,£23.74,(80% off)
123,English Navy,Men's Regular Fit Shirt,3.8 out of 5 stars,42,£4.95,£11.39,(57% off)
124,ELYYORK,Shirt for Men Plus Size||Shirt for Men Plus Size 4XL||6XL Shirts for Men Plus Size||Plus Shirts for Men||Plus Size Shirts for Men Full Sleeve,4.0 out of 5 stars,69,£4.74,£18.99,(75% off)
125,Van Heusen,Men's Cotton Solid Slim Fit Shirt,3.8 out of 5 stars,373,£9.49,£18.99,(50% off)
126,Thomas Scott,Geometric 1 Mens Slim Fit 100% Cotton Formal Shirt with Spread Collar and Full Sleeve,3.9 out of 5 stars,7,£4.95,£28.46,(83% off)
127,Allen Solly,Men's Cotton Regular Fit Polo T-Shirt,4.0 out of 5 stars,"75,275",£6.64,£10.44,(36% off)
128,Louis Philippe,Men's Slim Fit Printed Casual Shirt,3.6 out of 5 stars,12,£12.63,£23.27,(46% off)
129,The Indian Garage Co,Men's Cotton Slim Fit Checkered Full Sleeves Spread Collar Casual Shirt,4.0 out of 5 stars,148,£4.82,£16.62,(71% off)
130,Van Heusen,Men's Regular Fit Shirt,4.0 out of 5 stars,1,£16.05,£28.49,(44% off)
131,Amazon Brand - Symbol,Men's Cotton Shirt | Chinese Collar | Casual | Plain | Full Sleeve | Summer - Regular Fit (Available in Plus Size and Combo Packs),3.9 out of 5 stars,"6,767",£5.22,£17.09,(69% off)
132,Van Heusen,Men's Solid Modern Fit Shirt,4.0 out of 5 stars,1,£15.15,£29.44,(49% off)
133,BE ACTIVE,Men's Striped Regular Fit Shirt,3.9 out of 5 stars,23,£5.79,£14.24,(59% off)
134,Leriya Fashion,Men's Formal Button Down Shirt – Slim Fit Office Wear Shirt's for Men | Textured Long Sleeve Cotton Blend | Business & Meeting Ready (Available in Plus Size and Combo Pack of 2),4.0 out of 5 stars,225,£3.60,£18.99,(81% off)
135,Amazon Brand - Symbol,Men's Cotton Slim Fit Shirt,3.8 out of 5 stars,518,£3.70,£18.04,(80% off)
136,Amazon Brand - Symbol,Men's Cotton Regular Fit Shirt,3.8 out of 5 stars,"1,781",£3.13,£18.99,(84% off)
137,Majestic Man,Men's Standard Slim Fit Striped Pure Cotton Casual Shirt,4.0 out of 5 stars,304,£5.22,£14.24,(63% off)
138,Pinkmint,Men's Shirt Cotton BlendCasual Long Sleeve Formal Shirt Soild Formal Shirt for Men (Pack of 3),3.5 out of 5 stars,216,£7.12,£18.99,(63% off)
139,Louis Philippe,Men's Cotton Slim Fit Shirt,3.7 out of 5 stars,35,£12.32,£20.89,(41% off)
140,Urbano Fashion,Men's Cotton Full Sleeve Regular Fit Textured Shirt with Spread Collar,4.2 out of 5 stars,47,£7.64,£21.84,(65% off)
141,TOPLOT,Shirt for Men || Mens Casual Shirts || Full Sleeve || Regular Fit || Striped (5219),4.2 out of 5 stars,95,£4.74,£28.49,(83% off)
142,IndoPrimo,Men's Regular Fit Fancy Double Pocket Casual Shirt for Men Full Sleeves - Cargo,4.0 out of 5 stars,539,£4.74,£18.99,(75% off)
143,Van Heusen,Men's Cotton Solid Regular Fit T-Shirt,4.0 out of 5 stars,"40,722",£6.64,£10.44,(36% off)
144,Highlander,Men's Solid Slim Fit Shirt,4.0 out of 5 stars,1,£6.64,£23.27,(71% off)
145,Majestic Man,Comfort Slim Fit Spread Collar Small Checked Cotton Casual Shirt,4.1 out of 5 stars,28,£4.27,£14.24,(70% off)
146,Majestic Man,Men's Cotton Slim Fit Shirt,4.0 out of 5 stars,862,£4.74,£14.24,(67% off)
147,SMOWKLY,"Men's Casual Solid Printed Cotton Regular Fit Shirt || Half Sleeve, Button Down, Double Front Pocket || Denim Shacket Style Fashionable Western Outfit",4.7 out of 5 stars,146,£7.59,£14.24,(47% off)
148,TAGAS,Men's Hexa Pattern Button Up Full Sleeve Shirt|| Shirt for Mens ||Regular Shirt for Mens ||(MS-Hexa),3.9 out of 5 stars,113,£5.50,£14.24,(61% off)
149,Raymond,Men's Cotton Slim Fit Shirt,3.4 out of 5 stars,14,£9.30,£23.74,(61% off)
150,Allen Solly,Men's 100% Cotton Slim Fit Full Sleeve Checkered Formal Shirt,3.9 out of 5 stars,89,£10.49,£18.04,(42% off)
151,Majestic Man,Men Cotton Checkered Half Sleeve Slim Fit Casual Shirt,4.1 out of 5 stars,703,£6.93,£14.24,(51% off)
152,DEELMO,Men's Cotton Blend Mandarin Collar Self One Design Full Sleeve Casual Short Kurta,3.4 out of 5 stars,"1,456",£4.69,£20.89,(78% off)
153,XJARVIS,"Ozark/Austin Men's Combed Cotton and | Cotton Shirt | Slim Fit Formal Shirt with Pocket – Long Sleeve, Spread Collar, Breathable & Lightweight – Ideal for Summer, Office, Casual Wear",4.5 out of 5 stars,144,£8.26,£21.37,(61% off)
154,Amazon Brand - Symbol,Men's Solid Cotton Formal Shirt | Plain | Full Sleeve-Regular Fit (Available in Plus Size and Combo Packs),3.8 out of 5 stars,"2,256",£5.22,£15.19,(66% off)
155,Majestic Man,Cotton Checkered Slim Fit Casual Shirt For Men,3.8 out of 5 stars,"1,511",£4.74,£14.24,(67% off)
156,Thomas Scott,Men's Cotton Regular Fit Shirt,3.9 out of 5 stars,42,£5.32,£23.74,(78% off)
157,Majestic Man,Slim Fit Pure Cotton Checked Half Sleeve Casual Shirt,4.1 out of 5 stars,15,£4.08,£14.24,(71% off)
158,Peter England,Men Cotton Regular Fit Shirt,4.1 out of 5 stars,6,£9.49,£18.99,(50% off)
159,GRECIILOOKS,Shirt for Men | Mens Casual Shirt | Men Stylish Shirt | Men Textured Shirt | Men's Regular Fit | Men Formal Shirt | Men's Solid Slim Fit,4.8 out of 5 stars,101,£4.08,£18.99,(79% off)
160,Raymond,Men's Pure Cotton Structure Pattern Slim Fit Semi Cutaway Collar Full Sleeve Formal Shirt,4.7 out of 5 stars,4,£9.83,£21.84,(55% off)
161,Majestic Man,Men Slim Fit Pure Cotton Checkred Half Sleeve Casual Shirt,4.0 out of 5 stars,206,£4.74,£14.24,(67% off)
162,Majestic Man,Men Comfort Slim Fit Pure Cotton Tartan Checked Casual Shirt,4.2 out of 5 stars,60,£4.27,£14.24,(70% off)
163,ROYALSCOUT,"Combo of 2 Textured Shirts for Men | Long Sleeves Perfect for Smart Workwear, Relaxed Outings, or Formal Occasions",4.3 out of 5 stars,65,£8.54,£4.27,(64% off)
164,Van Heusen,Men's Solid Slim Fit Shirt,1.0 out of 5 stars,1,£14.24,£24.69,(42% off)
165,Pinkmint,"Cotton Blend Casual Shirt for Men Combo Shirt for Formal Wear, Regular Home Wear",3.2 out of 5 stars,232,£5.69,£18.99,(70% off)
166,Diverse,Men's Printed Slim Fit Formal Shirt,3.5 out of 5 stars,49,£4.77,£11.39,(58% off)
167,Majestic Man,Comfort Slim Fit Pure Cotton Checked Casual Shirt,4.1 out of 5 stars,47,£4.27,£14.24,(70% off)
168,Dennis Lingo,Men's Cotton Slim Fit Shirt,3.9 out of 5 stars,"3,595",£6.17,£23.74,(74% off)
169,Pinkmint,Men's Solid Regular Fit Shirt (Pack of 3),3.3 out of 5 stars,70,£7.12,£18.99,(63% off)
170,Lymio,Shirt for Men|| Regular Fit Shirt for Men|| Men Stylish Shirt (Tiedite-Shirt),3.7 out of 5 stars,118,£4.27,£28.49,(85% off)
171,SaintX,Men's Premium Solid Formal Shirt | Slim Fit | Plain Full Sleeve | Feather Touch Soft Finish | Wrinkle Resistant | 360° Highly Stretchable Fabric | Office/Party,3.9 out of 5 stars,19,£9.49,£23.74,(60% off)
172,Allen Solly,Men's 100% Cotton Slim Fit Full Sleeve Checkered Formal Shirt,4.0 out of 5 stars,109,£9.68,£18.04,(46% off)
173,Peter England,Men Cotton Slim Fit Shirt,4.0 out of 5 stars,3,£7.22,£15.19,(52% off)
174,Van Heusen,Men's Slim Fit Premium Business Formals 100% Cotton Print Shirt,5.0 out of 5 stars,1,£10.71,£21.84,(51% off)
175,Thomas Scott,Men's | Solid | Full Sleeve | Slim Fit | Linen Blend | Mandarin Collar | Casual Shirt,4.2 out of 5 stars,105,£8.84,£37.99,(77% off)
176,Urbano Plus,Men's Cotton Full Sleeve Regular Fit Textured Shirt with Spread Collar,4.1 out of 5 stars,42,£9.38,£24.69,(62% off)
177,Leriya Fashion,Men's Casual Cotton Shirt – Button Down Summer Shirt's for Men | Lightweight Textured Fabric | Perfect for Daily & Weekend Wear (Available in Plus Size and Combo Pack of 2),3.7 out of 5 stars,"2,953",£3.60,£18.99,(81% off)
178,Diverse,Men's Regular Fit Formal Shirt,3.9 out of 5 stars,"10,088",£4.74,£11.39,(58% off)
179,TAGDO,Men's Jacquard Chain Polo Shirt (2020),4.4 out of 5 stars,425,£3.79,£15.19,(75% off)
180,Louis Philippe,Men's Cotton Slim Fit Shirt,4.2 out of 5 stars,8,£9.78,£18.99,(49% off)
181,ROYALSCOUT,"Men's Cotton Blend Full Sleeve Short Kurta Featuring Mandarin Collar Perfect for Ethnic Styling, Work Gatherings, or Festive Events",4.2 out of 5 stars,186,£4.71,£14.24,(67% off)
182,Peter England,Men's Slim Fit Full Sleeve 100% Cotton Slub Casual Everyday Shirt,4.0 out of 5 stars,154,£7.60,£14.24,(47% off)
183,Zombom,Cotton Blend Solid Casual Regular Fit Mandarin/Chinese Collor Short Kurta for Men,3.8 out of 5 stars,"1,647",£4.74,£16.14,(71% off)
184,QUALIFT,"Shirt Tucker for Men - Skin-Friendly Soft Elastic Shirt Stays, Adjustable Shirt Garter Belt, Formal Shirt Holder with Non-Slip Strong Grip Clasp, Men's Tuck in Belt, Accessories for Man",4.0 out of 5 stars,34,£2.84,£6.64,(57% off)
185,Amazon Brand - Symbol,Men's Cotton Slim Fit Shirt,3.8 out of 5 stars,"3,027",£3.13,£9.49,(67% off)
186,Amazon Brand - Symbol,Men's Stretchable Formal Pants | Trousers (Slim Fit),3.8 out of 5 stars,"14,501",£7.59,£23.74,(68% off)
187,CB-COLEBROOK,Men's Casual Button Down Shirts Long Sleeve Linen Shirt Fashion Textured Beach Summer Shirts,3.8 out of 5 stars,"1,622",£4.74,£20.85,(77% off)
188,ELYYORK,Shirt for Men Plus Size||Shirt for Men Plus Size 4XL||6XL Shirts for Men Plus Size||Plus Shirts for Men||Plus Size Shirts for Men Full Sleeve|| Formal Shirt for Men||CB-PLS-01,3.4 out of 5 stars,60,£4.74,£18.99,(75% off)
189,Miraan,Men's Cotton Regular Fit Casual Denim Shirt (SIGDENIMM),3.7 out of 5 stars,"2,366",£6.38,£25.79,(75% off)
190,Van Heusen,Men's Cotton Solid Regular Fit Shirt,3.6 out of 5 stars,187,£10.48,£21.84,(52% off)
191,Majestic Man,Comfort Slim Fit Solid Pure Cotton Casual Shirt,4.5 out of 5 stars,17,£3.79,£14.24,(73% off)
192,Dennis Lingo,Men Solid Spread Collar Full Sleeves Regular Fit Cotton Casual Shirt,4.2 out of 5 stars,11,£4.74,£16.14,(71% off)
193,Peter England,Men's Solid Slim Fit Shirt,3.5 out of 5 stars,42,£7.58,£15.19,(50% off)
194,BE ACTIVE,Men's Casual Shirt|| Cotton Stylish Full Sleeves Shirt for Men,3.5 out of 5 stars,268,£6.32,£13.29,(52% off)
195,Zombom,"Men's Cotton Blend Full Sleeve Straight Kurta Designed for Elegant Ethnic Wear, Daily Comfort, or Festive Gatherings",3.7 out of 5 stars,682,£4.74,£16.14,(71% off)
196,Amazon Brand - Symbol,Men's Cotton Checkered Slim Fit Formal Shirt,3.8 out of 5 stars,234,£3.41,£15.19,(78% off)
197,Zombom,"Men's Cotton Blend Full Sleeve Straight Kurta Designed for Elegant Ethnic Wear, Daily Comfort, or Festive Gatherings",3.7 out of 5 stars,682,£4.74,£16.14,(71% off)
198,CB-COLEBROOK,Mens Stylish Solid Silk Satin Casual Dress Shirts for Men Shiny Long Sleeve Button Down Shirt Party Prom Wedding Shirt for Mens,3.4 out of 5 stars,22,£4.74,£23.74,(80% off)
199,FYLTR,Men's Solid Casual Shirt with Patch Pocket with Spread Collar- 100% Cotton | Regular Fit | Full Sleeves | Soft & Comfortable | Summer Shirts for Men,4.7 out of 5 stars,34,£6.36,£17.09,(63% off)
200,AVANOVA,Men's Trousers Light Business Style Slightly Stretch Straight Leg Pants for Outdoor Casual Daily Trouser II Men's Regular Casual Pants Trouser (Trouser 126),3.7 out of 5 stars,573,£6.64,£18.99,(65% off)
201,Majestic Man,Slim Fit Short Sleeve Checked Pure Cotton Casual Shirt,3.7 out of 5 stars,19,£3.79,£14.24,(73% off)
202,Peter England,Men's Cotton Slim Fit Shirt,5.0 out of 5 stars,1,£7.12,£13.29,(46% off)
203,Majestic Man,Men's Polyester Slim Fit Solid Satin Clubwear Formal Shirt,3.9 out of 5 stars,181,£4.74,£14.24,(67% off)
204,Leriya Fashion,Men's Formal Button Down Shirt – Slim Fit Office Wear Shirt's for Men | Textured Long Sleeve Cotton Blend | Business & Meeting Ready (Available in Plus Size and Combo Pack of 2),3.8 out of 5 stars,"1,977",£4.08,£18.99,(79% off)
205,Amazon Brand - Symbol,Men's Cotton Regular Fit Shirt,4.0 out of 5 stars,456,£5.41,£14.24,(62% off)
206,Amazon Brand - Symbol,Men's Solid 100% Cotton Regular Fit Formal Shirt (Pack of 2),3.9 out of 5 stars,"1,337",£7.02,£3.51,(63% off)
207,BE ACTIVE,Men's Casual Shirts|| Linen Cotton Lining Shirts for Men|| Stylish Full Sleeves Cotton Shirt for Men,3.4 out of 5 stars,296,£6.26,£18.04,(65% off)
208,Urbano Plus,Men's Cotton Full Sleeve Regular Fit Casual Solid Shirt,3.8 out of 5 stars,29,£7.64,£18.99,(60% off)
209,Majestic Man,Men's Cotton Slim Fit Shirt,4.2 out of 5 stars,340,£4.74,£14.24,(67% off)
210,Van Heusen,Men's Cotton Modern Fit Shirt,3.1 out of 5 stars,3,£10.92,£21.84,(50% off)
211,Diverse,Men's Regular Fit Formal Shirt,3.7 out of 5 stars,"8,998",£5.25,£11.39,(54% off)
212,Louis Philippe,Men's Sports Slim Fit Solid Cotton Blend Casual Shirt,3.8 out of 5 stars,5,£12.82,£23.74,(46% off)
213,Diverse,Men's Solid Regular Fit Formal Shirt DVF01F2L02-526E_Jet Black_46,3.9 out of 5 stars,258,£7.59,£11.39,(33% off)
214,FUNKY RICH,Funkyrich® Textured Popcorn Shirts for Men || Casual Shirt for Men || Shirt for Men|| Men Stylish Half Sleeve Shirt || Men Fancy Shirt,3.8 out of 5 stars,459,£3.79,£9.49,(60% off)
215,Leriya Fashion,Shirt for Man | Shirt for Men | Shirt | Men Shirt | Casual Shirts for Men | Trendi Shirt for Men,4.1 out of 5 stars,341,£4.36,£18.99,(77% off)
216,Van Heusen,Men's Slim Fit Premium Ceremonial 100% Cotton Print Shirt,4.0 out of 5 stars,1,£14.91,£26.59,(44% off)
217,Bellstone,Men's Solid Regular Fit Dress Shirt,3.6 out of 5 stars,"2,242",£3.79,£14.24,(73% off)
218,Indian Needle,Cotton Solid Formal Shirt for Mens,3.8 out of 5 stars,7,£5.75,£14.24,(60% off)
219,Louis Philippe,Men's Cotton Regular Fit Solid with Softer Finish Better Lusture & Durable T-Shirt,3.9 out of 5 stars,95,£9.49,£18.04,(47% off)
220,Leriya Fashion,for Casual Stylish Printed Regular Fit | Men Formal Half Sleeve Shirt,3.9 out of 5 stars,398,£3.60,£18.99,(81% off)
221,U.S. POLO ASSN.,Men's Cotton Regular Fit Shirt,4.7 out of 5 stars,4,£9.48,£21.84,(57% off)
222,Dennis Lingo,"Men's Cotton Solid Slim Fit Casual Shirt with Pocket, Roll Up Full Sleeve Shirt for Formal & Casual Wear",3.6 out of 5 stars,541,£5.69,£21.84,(74% off)
223,Pinkmint,Combo of Men's Regular Fit Popcorn Shirt Half Sleeve Spraed Collar Shirt (Pack of 2),3.6 out of 5 stars,280,£4.74,£2.37,(75% off)
224,Van Heusen,Formal Printed Shirt for Men| Premium Cotton| Full Sleeves| Slim Fit |Breathable Fabric,3.0 out of 5 stars,2,£11.07,£21.84,(49% off)
225,Thomas Scott,| Men's | Solid Color | Regular Fit | 100% Cotton | Short Sleeve | Spread Collar | Shirts for Men (Available in Plus Size),3.9 out of 5 stars,317,£5.77,£21.84,(74% off)
226,Majestic Man,Printed Pure Cotton Slim Fit Casual Shirt,3.8 out of 5 stars,18,£4.17,£14.24,(71% off)
227,TAGDO,Men's Solid Short Sleeve and Button Up Lapel Shirt with Textured Fabric (2028),4.4 out of 5 stars,56,£3.79,£18.99,(80% off)
228,Majestic Man,Comfort Cotton Slim Fit Checked Casual Shirt for Men,3.9 out of 5 stars,103,£4.27,£14.24,(70% off)
229,Amazon Brand - Symbol,Men's Solid Cotton Shirt | Chinese Collar | Casual | Plain | Full Sleeve | Summer-Regular Fit (Available in Plus Size),3.9 out of 5 stars,"2,500",£3.41,£18.04,(81% off)
230,Miraan,Men's Linen Cotton Long Sleeve Casual Regular Fit Shirt (Siglinen),3.7 out of 5 stars,374,£5.69,£24.77,(77% off)
231,Thomas Scott,Men's Solid Slim Fit 100% Cotton Casual Shirt with Button Down Collar and Full Sleeve,3.9 out of 5 stars,72,£6.17,£26.59,(77% off)
232,Dennis Lingo,"Men's Cotton Tartan Plaid Checkered Slim Fit Casual Shirt, Full Sleeve Shirt for Formal & Casual Wear",3.7 out of 5 stars,96,£5.22,£23.74,(78% off)
233,Van Heusen,Men's Cotton Slim Fit Shirt,4.6 out of 5 stars,5,£10.92,£21.84,(50% off)
234,DIVISIVE,Men's Solid Slim Fit Shirt,3.7 out of 5 stars,7,£3.79,£12.34,(69% off)
235,Van Heusen,Men's Cotton Modern Fit Shirt,4.3 out of 5 stars,8,£10.92,£21.84,(50% off)
236,TAGDO,Men's Waffle Knitted Crew Neck Regular Fit Tees (5154),4.2 out of 5 stars,"1,674",£3.32,£11.39,(71% off)
237,Majestic Man,Men Slim Fit Pure Cotton Solid Half Sleeve Casual Shirt,3.9 out of 5 stars,120,£4.46,£14.24,(69% off)
238,FYLTR,Men's 100% Cotton Chambray | Soft & Comfortable | Casual Shirt | Shirts for Men,3.7 out of 5 stars,102,£5.69,£14.24,(60% off)
239,Majestic Man,Slim Fit Printed Pure Cotton Casual Half Sleeve Shirt,4.8 out of 5 stars,8,£3.79,£14.24,(73% off)
